"No.","Time","Source","Destination","Protocol","Length","Info"
"43","0.140913","162.125.40.1","192.168.86.162","TCP","194","[TCP Retransmission] 443  >  56015 [ACK] Seq=1 Ack=1 Win=358 Len=128 TSval=3502118457 TSecr=4174596177"
"55","0.207241","192.168.86.162","192.168.86.47","TCP","78","56126  >  7000 [SYN, ECE, CWR] Seq=0 Win=65535 Len=0 MSS=1460 WS=64 TSval=3598801334 TSecr=0 SACK_PERM"
"56","0.216223","192.168.86.47","192.168.86.162","TCP","78","7000  >  56126 [SYN, ACK] Seq=0 Ack=1 Win=65535 Len=0 MSS=1460 WS=32 TSval=2796585809 TSecr=3598801334 SACK_PERM"
"57","0.216324","192.168.86.162","192.168.86.47","TCP","66","56126  >  7000 [ACK] Seq=1 Ack=1 Win=131712 Len=0 TSval=3598801402 TSecr=2796585809"
"58","0.216402","192.168.86.162","192.168.86.47","TCP","107","56126  >  7000 [PSH, ACK] Seq=1 Ack=1 Win=131712 Len=41 TSval=3598801402 TSecr=2796585809"
"61","0.224921","192.168.86.47","192.168.86.162","TCP","66","7000  >  56126 [ACK] Seq=1 Ack=42 Win=131712 Len=0 TSval=2796585817 TSecr=3598801402"
"62","0.240888","192.168.86.47","192.168.86.162","TCP","1514","7000  >  56126 [ACK] Seq=1 Ack=42 Win=131712 Len=1448 TSval=2796585833 TSecr=3598801402"
"63","0.240966","192.168.86.162","192.168.86.47","TCP","66","56126  >  7000 [ACK] Seq=42 Ack=1449 Win=130304 Len=0 TSval=3598801427 TSecr=2796585833"
"64","0.241300","192.168.86.47","192.168.86.162","TCP","677","7000  >  56126 [PSH, ACK] Seq=1449 Ack=42 Win=131712 Len=611 TSval=2796585833 TSecr=3598801402"
"65","0.241342","192.168.86.162","192.168.86.47","TCP","66","56126  >  7000 [ACK] Seq=42 Ack=2060 Win=130432 Len=0 TSval=3598801427 TSecr=2796585833"
"66","0.241487","192.168.86.162","192.168.86.47","TCP","66","56126  >  7000 [FIN, ACK] Seq=42 Ack=2060 Win=131072 Len=0 TSval=3598801427 TSecr=2796585833"
"69","0.256869","192.168.86.47","192.168.86.162","TCP","66","7000  >  56126 [ACK] Seq=2060 Ack=43 Win=131712 Len=0 TSval=2796585842 TSecr=3598801427"
"70","0.257391","192.168.86.47","192.168.86.162","TCP","66","7000  >  56126 [FIN, ACK] Seq=2060 Ack=43 Win=131712 Len=0 TSval=2796585842 TSecr=3598801427"
"73","0.257482","192.168.86.162","192.168.86.47","TCP","66","56126  >  7000 [ACK] Seq=43 Ack=2061 Win=131072 Len=0 TSval=3598801443 TSecr=2796585842"
"104","0.439304","157.240.11.54","192.168.86.162","TCP","66","443  >  54822 [ACK] Seq=1 Ack=129 Win=884 Len=0 TSval=3246780053 TSecr=523979293"
"110","0.447659","192.168.86.162","157.240.11.54","TCP","66","54822  >  443 [ACK] Seq=129 Ack=1135 Win=2030 Len=0 TSval=523979345 TSecr=3246780077"
"121","0.457786","192.168.86.162","8.8.4.4","TCP","78","56128  >  853 [SYN] Seq=0 Win=65535 Len=0 MSS=1460 WS=64 TSval=2969101551 TSecr=0 SACK_PERM"
"138","0.459014","192.168.86.162","8.8.4.4","TCP","78","56129  >  443 [SYN] Seq=0 Win=65535 Len=0 MSS=1460 WS=64 TSval=252729379 TSecr=0 SACK_PERM"
"158","0.484529","8.8.4.4","192.168.86.162","TCP","74","443  >  56129 [SYN, ACK] Seq=0 Ack=1 Win=65535 Len=0 MSS=1412 SACK_PERM TSval=1169388407 TSecr=252729379 WS=256"
"159","0.484621","192.168.86.162","8.8.4.4","TCP","66","56129  >  443 [ACK] Seq=1 Ack=1 Win=131584 Len=0 TSval=252729405 TSecr=1169388407"
"161","0.487299","8.8.4.4","192.168.86.162","TCP","74","853  >  56128 [SYN, ACK] Seq=0 Ack=1 Win=65535 Len=0 MSS=1412 SACK_PERM TSval=4095563190 TSecr=2969101551 WS=256"
"164","0.487435","192.168.86.162","8.8.4.4","TCP","66","56128  >  853 [ACK] Seq=1 Ack=1 Win=131584 Len=0 TSval=2969101581 TSecr=4095563190"
"171","0.528426","8.8.4.4","192.168.86.162","TCP","66","443  >  56129 [ACK] Seq=1 Ack=518 Win=268288 Len=0 TSval=1169388446 TSecr=252729405"
"177","0.532165","162.125.40.2","192.168.86.162","TCP","54","443  >  56097 [RST] Seq=1 Win=0 Len=0"
"187","0.532821","192.168.86.162","35.186.224.24","TCP","78","56130  >  443 [SYN] Seq=0 Win=65535 Len=0 MSS=1460 WS=64 TSval=3741464280 TSecr=0 SACK_PERM"
"188","0.532994","192.168.86.162","35.186.224.31","TCP","78","56131  >  443 [SYN] Seq=0 Win=65535 Len=0 MSS=1460 WS=64 TSval=2034207587 TSecr=0 SACK_PERM"
"192","0.534232","8.8.4.4","192.168.86.162","TCP","1466","[TCP Out-Of-Order] 443  >  56129 [ACK] Seq=1 Ack=518 Win=268800 Len=1400 TSval=1169388457 TSecr=252729405"
"193","0.534310","192.168.86.162","8.8.4.4","TCP","78","[TCP Dup ACK 159#1] 56129  >  443 [ACK] Seq=518 Ack=1 Win=131584 Len=0 TSval=252729454 TSecr=1169388446 SLE=1401 SRE=4244"
"194","0.534349","192.168.86.162","8.8.4.4","TCP","66","56129  >  443 [ACK] Seq=518 Ack=4244 Win=127296 Len=0 TSval=252729454 TSecr=1169388457"
"195","0.537183","192.168.86.162","8.8.4.4","TCP","66","[TCP Window Update] 56129  >  443 [ACK] Seq=518 Ack=4244 Win=131072 Len=0 TSval=252729457 TSecr=1169388457"
"204","0.538494","192.168.86.172","192.168.86.162","TCP","407","8009  >  50803 [PSH, ACK] Seq=1 Ack=1 Win=679 Len=341 TSval=2311859074 TSecr=1947085131 [TCP PDU reassembled in 231]"
"205","0.544225","192.168.86.30","192.168.86.162","TCP","414","8009  >  50948 [PSH, ACK] Seq=1 Ack=1 Win=679 Len=348 TSval=3963810248 TSecr=2223796380 [TCP PDU reassembled in 206]"
"207","0.557901","192.168.86.162","8.8.4.4","TCP","78","56132  >  853 [SYN] Seq=0 Win=65535 Len=0 MSS=1460 WS=64 TSval=4029457488 TSecr=0 SACK_PERM"
"209","0.558238","192.168.86.162","8.8.4.4","TCP","78","56133  >  443 [SYN] Seq=0 Win=65535 Len=0 MSS=1460 WS=64 TSval=964211522 TSecr=0 SACK_PERM"
"215","0.570389","192.168.86.162","192.225.158.2","TCP","78","56134  >  3478 [SYN] Seq=0 Win=65535 Len=0 MSS=1460 WS=64 TSval=2162177459 TSecr=0 SACK_PERM"
"216","0.570645","192.168.86.162","192.225.158.2","TCP","78","56135  >  3478 [SYN] Seq=0 Win=65535 Len=0 MSS=1460 WS=64 TSval=3800275674 TSecr=0 SACK_PERM"
"223","0.575112","192.168.86.30","192.168.86.162","TCP","414","8009  >  50948 [PSH, ACK] Seq=1741 Ack=1 Win=679 Len=348 TSval=3963810261 TSecr=2223796380"
"224","0.575113","192.168.86.30","192.168.86.162","TCP","1458","8009  >  50948 [PSH, ACK] Seq=2089 Ack=1 Win=679 Len=1392 TSval=3963810262 TSecr=2223796380"
"225","0.575113","8.8.4.4","192.168.86.162","TCP","1466","[TCP Spurious Retransmission] 443  >  56129 [ACK] Seq=1 Ack=518 Win=268800 Len=1400 TSval=1169388497 TSecr=252729454"
"226","0.575197","192.168.86.162","8.8.4.4","TCP","78","[TCP Retransmission] 56129  >  443 [FIN, ACK] Seq=606 Ack=4244 Win=131072 Len=0 TSval=252729495 TSecr=1169388457 SLE=1 SRE=1401"
"232","0.600288","8.8.4.4","192.168.86.162","TCP","66","853  >  56128 [ACK] Seq=1 Ack=518 Win=268288 Len=0 TSval=4095563262 TSecr=2969101581"
"233","0.600288","8.8.4.4","192.168.86.162","TCP","66","[TCP Dup ACK 232#1] 853  >  56128 [ACK] Seq=1 Ack=518 Win=268288 Len=0 TSval=4095563262 TSecr=2969101581"
"235","0.600289","192.168.86.172","192.168.86.162","TCP","407","8009  >  50803 [PSH, ACK] Seq=1365 Ack=1 Win=679 Len=341 TSval=2311859076 TSecr=1947085131"
"236","0.600289","192.168.86.172","192.168.86.162","TCP","407","8009  >  50803 [PSH, ACK] Seq=1706 Ack=1 Win=679 Len=341 TSval=2311859089 TSecr=1947085131"
"237","0.600290","8.8.4.4","192.168.86.162","TCP","1466","853  >  56128 [PSH, ACK] Seq=1401 Ack=518 Win=268800 Len=1400 TSval=4095563270 TSecr=2969101581 [TCP PDU reassembled in 240]"
"238","0.600290","192.168.86.172","192.168.86.162","TCP","1430","8009  >  50803 [PSH, ACK] Seq=2047 Ack=1 Win=679 Len=1364 TSval=2311859097 TSecr=1947085131"
"239","0.600291","8.8.4.4","192.168.86.162","TCP","1466","853  >  56128 [ACK] Seq=2801 Ack=518 Win=268800 Len=1400 TSval=4095563270 TSecr=2969101581 [TCP PDU reassembled in 240]"
"241","0.600416","192.168.86.162","8.8.4.4","TCP","66","56128  >  853 [ACK] Seq=518 Ack=4235 Win=127360 Len=0 TSval=2969101694 TSecr=4095563270"
"248","0.602839","192.168.86.162","8.8.4.4","TCP","66","[TCP Window Update] 56128  >  853 [ACK] Seq=518 Ack=4235 Win=131072 Len=0 TSval=2969101696 TSecr=4095563270"
"249","0.606049","192.168.86.162","35.186.224.46","TCP","54","49603  >  443 [RST, ACK] Seq=1 Ack=1 Win=2048 Len=0"
"251","0.616387","192.168.86.162","35.186.224.46","TCP","78","56136  >  443 [SYN] Seq=0 Win=65535 Len=0 MSS=1460 WS=64 TSval=1861186122 TSecr=0 SACK_PERM"
"254","0.620715","192.168.86.162","17.57.144.119","TCP","78","56137  >  5223 [SYN] Seq=0 Win=65535 Len=0 MSS=1460 WS=64 TSval=277353195 TSecr=0 SACK_PERM"
"274","0.634265","192.168.86.162","162.125.40.1","TCP","78","56138  >  443 [SYN] Seq=0 Win=65535 Len=0 MSS=1460 WS=64 TSval=2625281965 TSecr=0 SACK_PERM"
"275","0.634286","192.168.86.162","35.186.224.24","TCP","78","56139  >  443 [SYN] Seq=0 Win=65535 Len=0 MSS=1460 WS=64 TSval=3595726950 TSecr=0 SACK_PERM"
"282","0.663557","192.168.86.162","8.8.8.8","TCP","78","56140  >  853 [SYN] Seq=0 Win=65535 Len=0 MSS=1460 WS=64 TSval=937327983 TSecr=0 SACK_PERM"
"283","0.663949","192.168.86.162","8.8.8.8","TCP","78","56141  >  443 [SYN] Seq=0 Win=65535 Len=0 MSS=1460 WS=64 TSval=2699599865 TSecr=0 SACK_PERM"
"284","0.667078","35.186.224.31","192.168.86.162","TCP","74","443  >  56131 [SYN, ACK] Seq=0 Ack=1 Win=65535 Len=0 MSS=1412 SACK_PERM TSval=3154475703 TSecr=2034207587 WS=256"
"285","0.667079","35.186.224.24","192.168.86.162","TCP","74","443  >  56130 [SYN, ACK] Seq=0 Ack=1 Win=65535 Len=0 MSS=1412 SACK_PERM TSval=4072470178 TSecr=3741464280 WS=256"
"286","0.667157","192.168.86.162","35.186.224.31","TCP","66","56131  >  443 [ACK] Seq=1 Ack=1 Win=131584 Len=0 TSval=2034207722 TSecr=3154475703"
"287","0.667172","192.168.86.162","35.186.224.24","TCP","66","56130  >  443 [ACK] Seq=1 Ack=1 Win=131584 Len=0 TSval=3741464415 TSecr=4072470178"
"288","0.667407","192.168.86.162","35.186.224.31","TCP","1466","56131  >  443 [ACK] Seq=1 Ack=1 Win=131584 Len=1400 TSval=2034207722 TSecr=3154475703 [TCP PDU reassembled in 289]"
"290","0.667643","192.168.86.162","35.186.224.24","TCP","1466","56130  >  443 [ACK] Seq=1 Ack=1 Win=131584 Len=1400 TSval=3741464415 TSecr=4072470178 [TCP PDU reassembled in 291]"
"294","0.684832","192.168.86.30","192.168.86.162","TCP","1458","[TCP Retransmission] 8009  >  50948 [PSH, ACK] Seq=2089 Ack=1 Win=679 Len=1392 TSval=3963810354 TSecr=2223796380"
"296","0.684833","192.168.86.172","192.168.86.162","TCP","1430","[TCP Retransmission] 8009  >  50803 [PSH, ACK] Seq=2047 Ack=1 Win=679 Len=1364 TSval=2311859187 TSecr=1947085131"
"298","0.693669","8.8.4.4","192.168.86.162","TCP","78","[TCP Dup ACK 171#1] 443  >  56129 [ACK] Seq=4244 Ack=518 Win=268800 Len=0 TSval=1169388610 TSecr=252729457 SLE=606 SRE=607"
"299","0.693670","8.8.4.4","192.168.86.162","TCP","78","443  >  56129 [ACK] Seq=4244 Ack=582 Win=268800 Len=0 TSval=1169388610 TSecr=252729490 SLE=606 SRE=607"
"301","0.693670","8.8.4.4","192.168.86.162","TCP","74","443  >  56133 [SYN, ACK] Seq=0 Ack=1 Win=65535 Len=0 MSS=1412 SACK_PERM TSval=2868266519 TSecr=964211522 WS=256"
"302","0.693670","8.8.4.4","192.168.86.162","TCP","66","443  >  56129 [FIN, ACK] Seq=4858 Ack=607 Win=268800 Len=0 TSval=1169388611 TSecr=252729492"
"303","0.693712","192.168.86.162","8.8.4.4","TCP","154","[TCP Spurious Retransmission] 56129  >  443 [FIN, PSH, ACK] Seq=518 Ack=4244 Win=131072 Len=88 TSval=252729614 TSecr=1169388610"
"304","0.693746","192.168.86.162","8.8.4.4","TCP","54","56129  >  443 [RST] Seq=607 Win=0 Len=0"
"305","0.693827","192.168.86.162","8.8.4.4","TCP","66","56133  >  443 [ACK] Seq=1 Ack=1 Win=131584 Len=0 TSval=964211658 TSecr=2868266519"
"309","0.722922","17.57.144.119","192.168.86.162","TCP","74","5223  >  56137 [SYN, ACK] Seq=0 Ack=1 Win=31856 Len=0 MSS=1460 SACK_PERM TSval=1112172508 TSecr=277353195 WS=128"
"310","0.722956","192.168.86.162","17.57.144.119","TCP","66","56137  >  5223 [ACK] Seq=1 Ack=1 Win=131712 Len=0 TSval=277353297 TSecr=1112172508"
"312","0.729589","8.8.4.4","192.168.86.162","TCP","66","443  >  56133 [ACK] Seq=1 Ack=518 Win=268288 Len=0 TSval=2868266562 TSecr=964211659"
"317","0.736326","8.8.4.4","192.168.86.162","TCP","1466","[TCP Out-Of-Order] 443  >  56133 [ACK] Seq=1 Ack=518 Win=268800 Len=1400 TSval=2868266569 TSecr=964211659"
"318","0.736376","192.168.86.162","8.8.4.4","TCP","78","[TCP Dup ACK 305#1] 56133  >  443 [ACK] Seq=518 Ack=1 Win=131584 Len=0 TSval=964211700 TSecr=2868266562 SLE=1401 SRE=4244"
"319","0.736397","192.168.86.162","8.8.4.4","TCP","66","56133  >  443 [ACK] Seq=518 Ack=4244 Win=127296 Len=0 TSval=964211700 TSecr=2868266569"
"320","0.736433","192.168.86.162","8.8.4.4","TCP","66","[TCP Window Update] 56133  >  443 [ACK] Seq=518 Ack=4244 Win=131072 Len=0 TSval=964211700 TSecr=2868266569"
"323","0.776726","8.8.4.4","192.168.86.162","TCP","66","443  >  56133 [ACK] Seq=4244 Ack=582 Win=268800 Len=0 TSval=2868266608 TSecr=964211704"
"325","0.776821","192.168.86.162","8.8.4.4","TCP","54","56133  >  443 [RST] Seq=582 Win=0 Len=0"
"326","0.783160","8.8.4.4","192.168.86.162","TCP","66","443  >  56133 [FIN, ACK] Seq=4858 Ack=607 Win=268800 Len=0 TSval=2868266614 TSecr=964211706"
"329","0.788707","35.186.224.46","192.168.86.162","TCP","74","443  >  56136 [SYN, ACK] Seq=0 Ack=1 Win=65535 Len=0 MSS=1412 SACK_PERM TSval=2696658232 TSecr=1861186122 WS=256"
"338","0.788711","192.225.158.2","192.168.86.162","TCP","74","3478  >  56134 [SYN, ACK] Seq=0 Ack=1 Win=15928 Len=0 MSS=1460 SACK_PERM TSval=661161163 TSecr=2162177459 WS=512"
"339","0.788711","8.8.4.4","192.168.86.162","TCP","66","853  >  56128 [ACK] Seq=4235 Ack=607 Win=268800 Len=0 TSval=4095563395 TSecr=2969101715"
"340","0.788712","8.8.4.4","192.168.86.162","TCP","66","853  >  56128 [FIN, ACK] Seq=4235 Ack=607 Win=268800 Len=0 TSval=4095563395 TSecr=2969101715"
"341","0.788712","192.225.158.2","192.168.86.162","TCP","74","3478  >  56135 [SYN, ACK] Seq=0 Ack=1 Win=15928 Len=0 MSS=1460 SACK_PERM TSval=2664381075 TSecr=3800275674 WS=512"
"342","0.788712","8.8.4.4","192.168.86.162","TCP","74","853  >  56132 [SYN, ACK] Seq=0 Ack=1 Win=65535 Len=0 MSS=1412 SACK_PERM TSval=3675486143 TSecr=4029457488 WS=256"
"348","0.788715","162.125.40.1","192.168.86.162","TCP","74","443  >  56138 [SYN, ACK] Seq=0 Ack=1 Win=65535 Len=0 MSS=1440 SACK_PERM TSval=724434201 TSecr=2625281965 WS=512"
"349","0.788715","35.186.224.24","192.168.86.162","TCP","78","[TCP Dup ACK 285#1] 443  >  56130 [ACK] Seq=1 Ack=1 Win=67072 Len=0 TSval=4072470329 TSecr=3741464415 SLE=1401 SRE=2058"
"350","0.788716","35.186.224.24","192.168.86.162","TCP","66","443  >  56130 [ACK] Seq=1 Ack=2058 Win=69888 Len=0 TSval=4072470329 TSecr=3741464415"
"351","0.788807","192.168.86.162","35.186.224.46","TCP","66","56136  >  443 [ACK] Seq=1 Ack=1 Win=131584 Len=0 TSval=1861186295 TSecr=2696658232"
"352","0.788879","192.168.86.162","8.8.4.4","TCP","66","56128  >  853 [ACK] Seq=607 Ack=4236 Win=131072 Len=0 TSval=2969101882 TSecr=4095563395"
"353","0.788904","192.168.86.162","192.225.158.2","TCP","66","56134  >  3478 [ACK] Seq=1 Ack=1 Win=131712 Len=0 TSval=2162177678 TSecr=661161163"
"354","0.788932","192.168.86.162","35.186.224.24","TCP","1466","[TCP Spurious Retransmission] 56130  >  443 [ACK] Seq=1 Ack=1 Win=131584 Len=1400 TSval=3741464537 TSecr=4072470329"
"355","0.788954","192.168.86.162","162.125.40.1","TCP","66","56138  >  443 [ACK] Seq=1 Ack=1 Win=131328 Len=0 TSval=2625282120 TSecr=724434201"
"356","0.788970","192.168.86.162","8.8.4.4","TCP","66","56132  >  853 [ACK] Seq=1 Ack=1 Win=131584 Len=0 TSval=4029457719 TSecr=3675486143"
"357","0.788981","192.168.86.162","192.225.158.2","TCP","66","56135  >  3478 [ACK] Seq=1 Ack=1 Win=131712 Len=0 TSval=3800275893 TSecr=2664381075"
"361","0.789757","8.8.8.8","192.168.86.162","TCP","74","443  >  56141 [SYN, ACK] Seq=0 Ack=1 Win=65535 Len=0 MSS=1412 SACK_PERM TSval=2247890479 TSecr=2699599865 WS=256"
"373","0.790952","192.168.86.162","192.225.158.2","TCP","66","56135  >  3478 [FIN, ACK] Seq=1 Ack=1 Win=131712 Len=0 TSval=3800275895 TSecr=2664381075"
"374","0.791006","192.168.86.162","192.225.158.2","TCP","66","56134  >  3478 [FIN, ACK] Seq=1 Ack=1 Win=131712 Len=0 TSval=2162177680 TSecr=661161163"
"395","0.796366","35.186.224.24","192.168.86.162","TCP","74","443  >  56139 [SYN, ACK] Seq=0 Ack=1 Win=65535 Len=0 MSS=1412 SACK_PERM TSval=3137004564 TSecr=3595726950 WS=256"
"396","0.796436","192.168.86.162","35.186.224.24","TCP","66","56139  >  443 [ACK] Seq=1 Ack=1 Win=131584 Len=0 TSval=3595727113 TSecr=3137004564"
"397","0.796747","192.168.86.162","35.186.224.24","TCP","1466","56139  >  443 [ACK] Seq=1 Ack=1 Win=131584 Len=1400 TSval=3595727113 TSecr=3137004564 [TCP PDU reassembled in 398]"
"416","0.806581","35.186.224.31","192.168.86.162","TCP","78","[TCP Dup ACK 284#1] 443  >  56131 [ACK] Seq=1 Ack=1 Win=67072 Len=0 TSval=3154475854 TSecr=2034207722 SLE=1401 SRE=2124"
"417","0.806581","35.186.224.31","192.168.86.162","TCP","66","443  >  56131 [ACK] Seq=1 Ack=2124 Win=69888 Len=0 TSval=3154475854 TSecr=2034207722"
"419","0.806582","8.8.8.8","192.168.86.162","TCP","74","853  >  56140 [SYN, ACK] Seq=0 Ack=1 Win=65535 Len=0 MSS=1412 SACK_PERM TSval=2658866776 TSecr=937327983 WS=256"
"422","0.806583","8.8.4.4","192.168.86.162","TCP","54","443  >  56129 [RST] Seq=4244 Win=0 Len=0"
"423","0.806583","17.57.144.119","192.168.86.162","TCP","66","5223  >  56137 [ACK] Seq=1 Ack=518 Win=31872 Len=0 TSval=1112172573 TSecr=277353297"
"427","0.806584","17.57.144.119","192.168.86.162","TCP","1514","5223  >  56137 [PSH, ACK] Seq=1449 Ack=518 Win=31872 Len=1448 TSval=1112172574 TSecr=277353297 [TCP PDU reassembled in 428]"
"429","0.806652","192.168.86.162","35.186.224.24","TCP","66","56130  >  443 [ACK] Seq=2058 Ack=213 Win=131328 Len=0 TSval=3741464555 TSecr=4072470337"
"430","0.806690","192.168.86.162","35.186.224.31","TCP","1466","[TCP Spurious Retransmission] 56131  >  443 [ACK] Seq=1 Ack=1 Win=131584 Len=1400 TSval=2034207862 TSecr=3154475854"
"431","0.806708","192.168.86.162","35.186.224.31","TCP","66","56131  >  443 [ACK] Seq=2124 Ack=213 Win=131328 Len=0 TSval=2034207862 TSecr=3154475863"
"432","0.806733","192.168.86.162","8.8.8.8","TCP","66","56140  >  853 [ACK] Seq=1 Ack=1 Win=131584 Len=0 TSval=937328126 TSecr=2658866776"
"433","0.806758","192.168.86.162","17.57.144.119","TCP","66","56137  >  5223 [ACK] Seq=518 Ack=3590 Win=128128 Len=0 TSval=277353381 TSecr=1112172574"
"439","0.807296","192.168.86.162","35.186.224.24","TCP","78","56143  >  443 [SYN] Seq=0 Win=65535 Len=0 MSS=1460 WS=64 TSval=4284746207 TSecr=0 SACK_PERM"
"454","0.848366","192.168.86.162","13.64.180.106","TCP","78","56144  >  443 [SYN] Seq=0 Win=65535 Len=0 MSS=1460 WS=64 TSval=3529161127 TSecr=0 SACK_PERM"
"467","0.865665","8.8.4.4","192.168.86.162","TCP","66","[TCP Retransmission] 443  >  56133 [FIN, ACK] Seq=4858 Ack=607 Win=268800 Len=0 TSval=2868266699 TSecr=964211706"
"468","0.873046","35.186.224.46","192.168.86.162","TCP","66","443  >  56136 [ACK] Seq=1 Ack=518 Win=66816 Len=0 TSval=2696658378 TSecr=1861186295"
"470","0.873048","8.8.4.4","192.168.86.162","TCP","66","853  >  56132 [ACK] Seq=1 Ack=518 Win=268800 Len=0 TSval=3675486283 TSecr=4029457720"
"476","0.873309","192.168.86.162","35.186.224.46","TCP","78","[TCP Dup ACK 351#1] 56136  >  443 [ACK] Seq=518 Ack=1 Win=131584 Len=0 TSval=1861186379 TSecr=2696658378 SLE=1401 SRE=2049"
"477","0.873309","192.168.86.162","8.8.4.4","TCP","66","56132  >  853 [ACK] Seq=518 Ack=1401 Win=130176 Len=0 TSval=4029457803 TSecr=3675486291"
"480","0.887448","35.186.224.24","192.168.86.162","TCP","66","443  >  56139 [ACK] Seq=1 Ack=1401 Win=68352 Len=0 TSval=3137004697 TSecr=3595727113"
"481","0.887449","35.186.224.24","192.168.86.162","TCP","66","443  >  56139 [ACK] Seq=1 Ack=2120 Win=71168 Len=0 TSval=3137004718 TSecr=3595727113"
"483","0.887550","192.168.86.162","35.186.224.24","TCP","66","56139  >  443 [ACK] Seq=2120 Ack=213 Win=131328 Len=0 TSval=3595727204 TSecr=3137004725"
"485","0.901170","192.168.86.172","192.168.86.162","TCP","1430","[TCP Retransmission] 8009  >  50803 [PSH, ACK] Seq=1 Ack=1 Win=679 Len=1364 TSval=2311859437 TSecr=1947085131 [TCP PDU reassembled in 231]"
"488","0.911977","192.168.86.30","192.168.86.162","TCP","414","[TCP Retransmission] 8009  >  50948 [PSH, ACK] Seq=1 Ack=1 Win=679 Len=348 TSval=3963810624 TSecr=2223796380"
"494","0.956946","192.225.158.2","192.168.86.162","TCP","66","3478  >  56135 [RST, ACK] Seq=1 Ack=2 Win=16384 Len=0 TSval=2664381214 TSecr=3800275895"
"495","0.956946","35.186.224.31","192.168.86.162","TCP","78","443  >  56131 [ACK] Seq=213 Ack=2188 Win=69888 Len=0 TSval=3154475983 TSecr=2034207862 SLE=1 SRE=1401"
"497","0.956947","192.225.158.2","192.168.86.162","TCP","66","3478  >  56134 [RST, ACK] Seq=1 Ack=2 Win=16384 Len=0 TSval=661161303 TSecr=2162177680"
"498","0.956947","35.186.224.24","192.168.86.162","TCP","74","443  >  56143 [SYN, ACK] Seq=0 Ack=1 Win=65535 Len=0 MSS=1412 SACK_PERM TSval=1713519145 TSecr=4284746207 WS=256"
"503","0.956949","8.8.8.8","192.168.86.162","TCP","66","853  >  56140 [ACK] Seq=1 Ack=518 Win=268288 Len=0 TSval=2658866905 TSecr=937328126"
"511","0.956951","8.8.4.4","192.168.86.162","TCP","1466","853  >  56132 [PSH, ACK] Seq=1401 Ack=518 Win=268800 Len=1400 TSval=3675486291 TSecr=4029457720 [TCP PDU reassembled in 523]"
"512","0.956952","35.186.224.46","192.168.86.162","TCP","1466","[TCP Out-Of-Order] 443  >  56136 [ACK] Seq=1 Ack=518 Win=66816 Len=1400 TSval=2696658380 TSecr=1861186295"
"517","0.957006","8.8.4.4","192.168.86.162","TCP","1466","853  >  56132 [ACK] Seq=2801 Ack=518 Win=268800 Len=1400 TSval=3675486291 TSecr=4029457720 [TCP PDU reassembled in 523]"
"519","0.957007","8.8.8.8","192.168.86.162","TCP","1466","853  >  56140 [PSH, ACK] Seq=1401 Ack=518 Win=268800 Len=1400 TSval=2658866912 TSecr=937328126 [TCP PDU reassembled in 525]"
"524","0.957009","8.8.8.8","192.168.86.162","TCP","1466","853  >  56140 [ACK] Seq=2801 Ack=518 Win=268800 Len=1400 TSval=2658866912 TSecr=937328126 [TCP PDU reassembled in 525]"
"526","0.957100","192.168.86.162","35.186.224.24","TCP","66","56143  >  443 [ACK] Seq=1 Ack=1 Win=131584 Len=0 TSval=4284746357 TSecr=1713519145"
"527","0.957119","192.168.86.162","35.186.224.24","TCP","66","56130  >  443 [ACK] Seq=2122 Ack=831 Win=130752 Len=0 TSval=3741464705 TSecr=4072470458"
"528","0.957120","192.168.86.162","35.186.224.31","TCP","66","56131  >  443 [ACK] Seq=2188 Ack=831 Win=130752 Len=0 TSval=2034208012 TSecr=3154475983"
"529","0.957147","192.168.86.162","8.8.8.8","TCP","66","56140  >  853 [ACK] Seq=518 Ack=1401 Win=130176 Len=0 TSval=937328276 TSecr=2658866912"
"530","0.957222","192.168.86.162","35.186.224.46","TCP","66","56136  >  443 [ACK] Seq=518 Ack=2049 Win=129536 Len=0 TSval=1861186463 TSecr=2696658380"
"531","0.957238","192.168.86.162","8.8.4.4","TCP","66","56132  >  853 [ACK] Seq=518 Ack=2801 Win=129664 Len=0 TSval=4029457887 TSecr=3675486291"
"532","0.957276","192.168.86.162","8.8.4.4","TCP","66","56132  >  853 [ACK] Seq=518 Ack=4236 Win=128192 Len=0 TSval=4029457887 TSecr=3675486291"
"533","0.957285","192.168.86.162","35.186.224.46","TCP","66","56136  >  443 [ACK] Seq=518 Ack=3392 Win=128192 Len=0 TSval=1861186463 TSecr=2696658380"
"534","0.957293","192.168.86.162","8.8.8.8","TCP","66","56140  >  853 [ACK] Seq=518 Ack=4236 Win=128192 Len=0 TSval=937328276 TSecr=2658866912"
"535","0.957464","192.168.86.162","8.8.8.8","TCP","66","[TCP Window Update] 56140  >  853 [ACK] Seq=518 Ack=4236 Win=131072 Len=0 TSval=937328276 TSecr=2658866912"
"536","0.957473","192.168.86.162","35.186.224.24","TCP","1466","56143  >  443 [ACK] Seq=1 Ack=1 Win=131584 Len=1400 TSval=4284746357 TSecr=1713519145 [TCP PDU reassembled in 537]"
"541","0.957840","192.168.86.162","8.8.4.4","TCP","66","[TCP Window Update] 56132  >  853 [ACK] Seq=518 Ack=4236 Win=131072 Len=0 TSval=4029457887 TSecr=3675486291"
"549","0.958341","192.168.86.162","35.186.224.46","TCP","66","[TCP Window Update] 56136  >  443 [ACK] Seq=518 Ack=3392 Win=131072 Len=0 TSval=1861186465 TSecr=2696658380"
"552","0.962912","192.168.86.162","8.8.4.4","TCP","66","56132  >  853 [FIN, ACK] Seq=518 Ack=4236 Win=131072 Len=0 TSval=4029457892 TSecr=3675486291"
"558","0.976186","192.168.86.162","192.225.158.2","TCP","78","56146  >  3478 [SYN] Seq=0 Win=65535 Len=0 MSS=1460 WS=64 TSval=2782124543 TSecr=0 SACK_PERM"
"564","0.985496","192.168.86.162","192.168.86.47","TCP","78","56147  >  49153 [SYN] Seq=0 Win=65535 Len=0 MSS=1460 WS=64 TSval=104033093 TSecr=0 SACK_PERM"
"571","1.004983","17.57.144.119","192.168.86.162","TCP","66","5223  >  56137 [ACK] Seq=3590 Ack=1544 Win=31872 Len=0 TSval=1112172688 TSecr=277353386"
"574","1.004984","13.64.180.106","192.168.86.162","TCP","66","443  >  56144 [SYN, ACK] Seq=0 Ack=1 Win=8192 Len=0 MSS=1440 WS=1 SACK_PERM"
"579","1.004986","162.125.40.1","192.168.86.162","TCP","66","443  >  56138 [ACK] Seq=1 Ack=181 Win=65536 Len=0 TSval=724434392 TSecr=2625282191"
"581","1.004987","35.186.224.46","192.168.86.162","TCP","1466","[TCP Spurious Retransmission] 443  >  56136 [ACK] Seq=1 Ack=518 Win=66816 Len=1400 TSval=2696658482 TSecr=1861186379"
"589","1.004990","162.125.40.1","192.168.86.162","TCP","800","443  >  56138 [PSH, ACK] Seq=2897 Ack=181 Win=65536 Len=734 TSval=724434393 TSecr=2625282191"
"591","1.004992","162.125.40.1","192.168.86.162","TCP","1514","[TCP Out-Of-Order] 443  >  56138 [ACK] Seq=1 Ack=181 Win=65536 Len=1448 TSval=724434393 TSecr=2625282191"
"594","1.005081","192.168.86.162","17.57.144.119","TCP","66","56137  >  5223 [ACK] Seq=1544 Ack=3655 Win=130944 Len=0 TSval=277353579 TSecr=1112172688"
"595","1.005129","192.168.86.162","13.64.180.106","TCP","54","56144  >  443 [ACK] Seq=1 Ack=1 Win=262144 Len=0"
"596","1.005180","192.168.86.162","162.125.40.1","TCP","78","[TCP Dup ACK 355#1] 56138  >  443 [ACK] Seq=181 Ack=1 Win=131328 Len=0 TSval=2625282336 TSecr=724434392 SLE=1449 SRE=3631"
"597","1.005192","192.168.86.162","162.125.40.1","TCP","66","56138  >  443 [ACK] Seq=181 Ack=3631 Win=127744 Len=0 TSval=2625282336 TSecr=724434393"
"598","1.005204","192.168.86.162","35.186.224.46","TCP","78","[TCP Dup ACK 533#1] 56136  >  443 [ACK] Seq=1333 Ack=3392 Win=131072 Len=0 TSval=1861186511 TSecr=2696658380 SLE=1 SRE=1401"
"612","1.015253","192.168.86.162","162.125.40.1","TCP","66","[TCP Window Update] 56138  >  443 [ACK] Seq=181 Ack=3631 Win=131072 Len=0 TSval=2625282346 TSecr=724434393"
"628","1.053678","192.168.86.47","192.168.86.162","TCP","78","49153  >  56147 [SYN, ACK] Seq=0 Ack=1 Win=65535 Len=0 MSS=1460 WS=32 TSval=1305086446 TSecr=104033093 SACK_PERM"
"629","1.053762","192.168.86.162","192.168.86.47","TCP","66","56147  >  49153 [ACK] Seq=1 Ack=1 Win=131712 Len=0 TSval=104033161 TSecr=1305086446"
"630","1.054360","192.168.86.162","192.168.86.47","TCP","117","56147  >  49153 [PSH, ACK] Seq=1 Ack=1 Win=131712 Len=51 TSval=104033161 TSecr=1305086446"
"633","1.067465","192.168.86.47","192.168.86.162","TCP","66","49153  >  56147 [ACK] Seq=1 Ack=52 Win=131712 Len=0 TSval=1305086498 TSecr=104033161"
"634","1.070048","192.168.86.47","192.168.86.162","TCP","201","49153  >  56147 [PSH, ACK] Seq=1 Ack=52 Win=131712 Len=135 TSval=1305086505 TSecr=104033161"
"635","1.070119","192.168.86.162","192.168.86.47","TCP","66","56147  >  49153 [ACK] Seq=52 Ack=136 Win=131584 Len=0 TSval=104033177 TSecr=1305086505"
"636","1.072854","192.168.86.162","192.168.86.47","TCP","164","56147  >  49153 [PSH, ACK] Seq=52 Ack=136 Win=131584 Len=98 TSval=104033180 TSecr=1305086505"
"639","1.084034","192.168.86.47","192.168.86.162","TCP","66","49153  >  56147 [ACK] Seq=136 Ack=150 Win=131616 Len=0 TSval=1305086513 TSecr=104033180"
"641","1.084035","8.8.4.4","192.168.86.162","TCP","66","853  >  56132 [FIN, ACK] Seq=4236 Ack=519 Win=268800 Len=0 TSval=3675486458 TSecr=4029457892"
"642","1.084035","35.186.224.46","192.168.86.162","TCP","66","443  >  56136 [ACK] Seq=3392 Ack=1333 Win=69632 Len=0 TSval=2696658547 TSecr=1861186471"
"646","1.084036","35.186.224.24","192.168.86.162","TCP","78","[TCP Dup ACK 498#1] 443  >  56143 [ACK] Seq=1 Ack=1 Win=268800 Len=0 TSval=1713519293 TSecr=4284746357 SLE=1401 SRE=2056"
"647","1.084037","35.186.224.24","192.168.86.162","TCP","66","443  >  56143 [ACK] Seq=1 Ack=2056 Win=266752 Len=0 TSval=1713519293 TSecr=4284746357"
"654","1.084039","8.8.8.8","192.168.86.162","TCP","66","853  >  56140 [ACK] Seq=4236 Ack=607 Win=268800 Len=0 TSval=2658867055 TSecr=937328281"
"655","1.084039","8.8.8.8","192.168.86.162","TCP","66","853  >  56140 [FIN, ACK] Seq=4236 Ack=607 Win=268800 Len=0 TSval=2658867055 TSecr=937328281"
"658","1.084040","192.225.158.2","192.168.86.162","TCP","74","3478  >  56146 [SYN, ACK] Seq=0 Ack=1 Win=15928 Len=0 MSS=1460 SACK_PERM TSval=2500207848 TSecr=2782124543 WS=512"
"659","1.084040","8.8.8.8","192.168.86.162","TCP","74","[TCP Retransmission] 443  >  56141 [SYN, ACK] Seq=0 Ack=1 Win=65535 Len=0 MSS=1412 SACK_PERM TSval=2247890783 TSecr=2699599865 WS=256"
"663","1.084145","192.168.86.162","35.186.224.24","TCP","1466","[TCP Spurious Retransmission] 56143  >  443 [ACK] Seq=1 Ack=1 Win=131584 Len=1400 TSval=4284746484 TSecr=1713519293"
"664","1.084301","192.168.86.162","35.186.224.24","TCP","66","56143  >  443 [ACK] Seq=2056 Ack=213 Win=131328 Len=0 TSval=4284746484 TSecr=1713519301"
"665","1.084306","192.168.86.162","35.186.224.46","TCP","66","56136  >  443 [ACK] Seq=1333 Ack=4625 Win=129792 Len=0 TSval=1861186590 TSecr=2696658604"
"666","1.084337","192.168.86.162","8.8.4.4","TCP","66","56132  >  853 [ACK] Seq=519 Ack=4237 Win=131072 Len=0 TSval=4029458014 TSecr=3675486458"
"667","1.084379","192.168.86.162","8.8.8.8","TCP","66","56140  >  853 [ACK] Seq=607 Ack=4237 Win=131072 Len=0 TSval=937328403 TSecr=2658867055"
"668","1.084402","192.168.86.162","192.225.158.2","TCP","66","56146  >  3478 [ACK] Seq=1 Ack=1 Win=131712 Len=0 TSval=2782124651 TSecr=2500207848"
"688","1.086923","192.168.86.162","37.16.4.196","TCP","78","56148  >  443 [SYN] Seq=0 Win=65535 Len=0 MSS=1460 WS=64 TSval=1349090071 TSecr=0 SACK_PERM"
"693","1.092964","192.168.86.162","35.186.224.24","TCP","66","56139  >  443 [ACK] Seq=2184 Ack=831 Win=130752 Len=0 TSval=3595727409 TSecr=3137004785"
"694","1.102457","192.168.86.47","192.168.86.162","TCP","79","49153  >  56147 [PSH, ACK] Seq=136 Ack=150 Win=131616 Len=13 TSval=1305086532 TSecr=104033180"
"695","1.102533","192.168.86.162","192.168.86.47","TCP","66","56147  >  49153 [ACK] Seq=150 Ack=149 Win=131584 Len=0 TSval=104033210 TSecr=1305086532"
"696","1.103117","192.168.86.162","192.168.86.47","TCP","1514","56147  >  49153 [ACK] Seq=150 Ack=149 Win=131584 Len=1448 TSval=104033210 TSecr=1305086532"
"697","1.103118","192.168.86.162","192.168.86.47","TCP","1514","56147  >  49153 [ACK] Seq=1598 Ack=149 Win=131584 Len=1448 TSval=104033210 TSecr=1305086532"
"698","1.103132","192.168.86.162","192.168.86.47","TCP","934","56147  >  49153 [PSH, ACK] Seq=3046 Ack=149 Win=131584 Len=868 TSval=104033210 TSecr=1305086532"
"702","1.105372","8.8.4.4","192.168.86.162","TCP","680","[TCP Retransmission] 443  >  56133 [FIN, PSH, ACK] Seq=4244 Ack=607 Win=268800 Len=614 TSval=2868266939 TSecr=964211706"
"712","1.114068","192.168.86.47","192.168.86.162","TCP","66","49153  >  56147 [ACK] Seq=149 Ack=3914 Win=127840 Len=0 TSval=1305086549 TSecr=104033210"
"713","1.116616","192.168.86.47","192.168.86.162","TCP","66","[TCP Window Update] 49153  >  56147 [ACK] Seq=149 Ack=3914 Win=131072 Len=0 TSval=1305086549 TSecr=104033210"
"716","1.138669","17.57.144.121","192.168.86.162","TCP","66","5223  >  49593 [FIN, ACK] Seq=25 Ack=1 Win=8004 Len=0 TSval=4083460090 TSecr=3948423322"
"724","1.138675","13.64.180.106","192.168.86.162","TCP","1514","[TCP Previous segment not captured] 443  >  56144 [PSH, ACK] Seq=1461 Ack=185 Win=8008 Len=1460"
"730","1.138681","13.64.180.106","192.168.86.162","TCP","1514","[TCP Out-Of-Order] 443  >  56144 [PSH, ACK] Seq=1 Ack=185 Win=8008 Len=1460"
"733","1.138683","13.64.180.106","192.168.86.162","TCP","1514","443  >  56144 [PSH, ACK] Seq=4381 Ack=185 Win=8008 Len=1460"
"738","1.138823","192.168.86.162","17.57.144.119","TCP","66","56137  >  5223 [ACK] Seq=2117 Ack=3873 Win=130816 Len=0 TSval=277353713 TSecr=1112172904"
"739","1.138964","192.168.86.162","13.64.180.106","TCP","66","[TCP Dup ACK 595#1] 56144  >  443 [ACK] Seq=185 Ack=1 Win=262144 Len=0 SLE=1461 SRE=4381"
"740","1.138993","192.168.86.162","13.64.180.106","TCP","54","56144  >  443 [ACK] Seq=185 Ack=4381 Win=257728 Len=0"
"741","1.139015","192.168.86.162","13.64.180.106","TCP","54","56144  >  443 [ACK] Seq=185 Ack=5841 Win=256256 Len=0"
"742","1.139100","192.168.86.162","13.64.180.106","TCP","54","[TCP Window Update] 56144  >  443 [ACK] Seq=185 Ack=5841 Win=262144 Len=0"
"749","1.140508","192.168.86.162","104.154.127.247","TCP","78","56149  >  4070 [SYN] Seq=0 Win=65535 Len=0 MSS=1460 WS=64 TSval=2267297288 TSecr=0 SACK_PERM"
"754","1.149747","35.186.224.24","192.168.86.162","TCP","78","443  >  56143 [ACK] Seq=213 Ack=2120 Win=266752 Len=0 TSval=1713519408 TSecr=4284746484 SLE=1 SRE=1401"
"760","1.149750","37.16.4.196","192.168.86.162","TCP","74","443  >  56148 [SYN, ACK] Seq=0 Ack=1 Win=65535 Len=0 MSS=1180 SACK_PERM TSval=1091579968 TSecr=1349090071 WS=2048"
"764","1.149752","35.186.224.46","192.168.86.162","TCP","66","443  >  56136 [ACK] Seq=4625 Ack=1365 Win=69632 Len=0 TSval=2696658673 TSecr=1861186596"
"765","1.149752","192.225.158.2","192.168.86.162","TCP","66","3478  >  56146 [ACK] Seq=1 Ack=29 Win=16384 Len=0 TSval=2500207947 TSecr=2782124653"
"766","1.149752","192.225.158.2","192.168.86.162","TCP","66","[TCP Dup ACK 765#1] 3478  >  56146 [ACK] Seq=1 Ack=29 Win=16384 Len=0 TSval=2500207947 TSecr=2782124653"
"782","1.164519","162.125.40.1","192.168.86.162","TCP","66","443  >  56138 [ACK] Seq=3631 Ack=256 Win=65536 Len=0 TSval=724434623 TSecr=2625282364"
"807","1.196224","192.168.86.162","17.57.144.119","TCP","66","56137  >  5223 [ACK] Seq=2346 Ack=3963 Win=130944 Len=0 TSval=277353770 TSecr=1112172995"
"808","1.196239","192.168.86.162","17.57.144.119","TCP","66","56137  >  5223 [ACK] Seq=2346 Ack=4027 Win=130880 Len=0 TSval=277353770 TSecr=1112173002"
"809","1.196249","192.168.86.162","35.186.224.46","TCP","66","56136  >  443 [ACK] Seq=1365 Ack=4653 Win=131008 Len=0 TSval=1861186702 TSecr=2696658717"
"810","1.196281","192.168.86.162","13.64.180.106","TCP","54","56144  >  443 [ACK] Seq=185 Ack=5942 Win=262016 Len=0"
"820","1.204359","192.168.86.162","17.57.144.119","TCP","1514","56137  >  5223 [ACK] Seq=2346 Ack=4027 Win=131072 Len=1448 TSval=277353779 TSecr=1112173002 [TCP PDU reassembled in 825]"
"821","1.204361","192.168.86.162","17.57.144.119","TCP","1514","56137  >  5223 [ACK] Seq=3794 Ack=4027 Win=131072 Len=1448 TSval=277353779 TSecr=1112173002 [TCP PDU reassembled in 825]"
"822","1.204362","192.168.86.162","17.57.144.119","TCP","1514","56137  >  5223 [ACK] Seq=5242 Ack=4027 Win=131072 Len=1448 TSval=277353779 TSecr=1112173002 [TCP PDU reassembled in 825]"
"823","1.204364","192.168.86.162","17.57.144.119","TCP","1514","56137  >  5223 [ACK] Seq=6690 Ack=4027 Win=131072 Len=1448 TSval=277353779 TSecr=1112173002 [TCP PDU reassembled in 825]"
"824","1.204365","192.168.86.162","17.57.144.119","TCP","1514","56137  >  5223 [ACK] Seq=8138 Ack=4027 Win=131072 Len=1448 TSval=277353779 TSecr=1112173002 [TCP PDU reassembled in 825]"
"831","1.209327","192.168.86.47","192.168.86.162","TCP","1514","49153  >  56147 [ACK] Seq=149 Ack=3914 Win=131072 Len=1448 TSval=1305086638 TSecr=104033210"
"838","1.209330","192.168.86.47","192.168.86.162","TCP","1514","49153  >  56147 [ACK] Seq=1597 Ack=3914 Win=131072 Len=1448 TSval=1305086638 TSecr=104033210"
"839","1.209331","192.168.86.47","192.168.86.162","TCP","1514","49153  >  56147 [ACK] Seq=3045 Ack=3914 Win=131072 Len=1448 TSval=1305086638 TSecr=104033210"
"840","1.209332","192.168.86.47","192.168.86.162","TCP","1514","49153  >  56147 [ACK] Seq=4493 Ack=3914 Win=131072 Len=1448 TSval=1305086638 TSecr=104033210"
"841","1.209333","192.168.86.47","192.168.86.162","TCP","978","49153  >  56147 [PSH, ACK] Seq=5941 Ack=3914 Win=131072 Len=912 TSval=1305086638 TSecr=104033210"
"855","1.235953","192.168.86.162","35.186.224.46","TCP","78","56150  >  443 [SYN] Seq=0 Win=65535 Len=0 MSS=1460 WS=64 TSval=2427781223 TSecr=0 SACK_PERM"
"864","1.257500","fe80::14b6:ff83:a412:ebee","fe80::1cc1:4cef:1e0a:8c4f","TCP","86","49153  >  49591 [FIN, ACK] Seq=1 Ack=1 Win=4096 Len=0 TSval=3891312659 TSecr=1310734468"
"866","1.257500","192.168.86.47","192.168.86.162","TCP","201","49153  >  56147 [PSH, ACK] Seq=6853 Ack=3914 Win=131072 Len=135 TSval=1305086658 TSecr=104033210"
"870","1.257864","192.168.86.162","192.168.86.47","TCP","66","56147  >  49153 [ACK] Seq=3914 Ack=6853 Win=124864 Len=0 TSval=104033317 TSecr=1305086638"
"871","1.257883","192.168.86.162","192.168.86.47","TCP","66","[TCP Window Update] 56147  >  49153 [ACK] Seq=3914 Ack=6853 Win=131072 Len=0 TSval=104033320 TSecr=1305086638"
"872","1.257888","192.168.86.162","192.168.86.47","TCP","66","56147  >  49153 [ACK] Seq=3914 Ack=6988 Win=130880 Len=0 TSval=104033365 TSecr=1305086658"
"887","1.357361","37.16.4.196","192.168.86.162","TCP","66","443  >  56148 [ACK] Seq=1 Ack=518 Win=67584 Len=0 TSval=1091580062 TSecr=1349090134"
"891","1.357363","17.57.144.121","192.168.86.162","TCP","66","[TCP Retransmission] 5223  >  49593 [FIN, ACK] Seq=25 Ack=1 Win=8004 Len=0 TSval=4083460216 TSecr=3948423322"
"892","1.357363","162.125.40.1","192.168.86.162","TCP","66","443  >  56138 [ACK] Seq=3631 Ack=307 Win=65536 Len=0 TSval=724434711 TSecr=2625282496"
"898","1.357365","104.154.127.247","192.168.86.162","TCP","74","4070  >  56149 [SYN, ACK] Seq=0 Ack=1 Win=21120 Len=0 MSS=1420 SACK_PERM TSval=3090622504 TSecr=2267297288 WS=4096"
"901","1.357366","17.57.144.119","192.168.86.162","TCP","78","[TCP Dup ACK 803#1] 5223  >  56137 [ACK] Seq=4027 Ack=2346 Win=31872 Len=0 TSval=1112173064 TSecr=277353770 SLE=5242 SRE=6690"
"902","1.357367","17.57.144.119","192.168.86.162","TCP","78","[TCP Dup ACK 803#2] 5223  >  56137 [ACK] Seq=4027 Ack=2346 Win=31872 Len=0 TSval=1112173064 TSecr=277353770 SLE=5242 SRE=9586"
"903","1.357367","17.57.144.119","192.168.86.162","TCP","78","[TCP Dup ACK 803#3] 5223  >  56137 [ACK] Seq=4027 Ack=2346 Win=31872 Len=0 TSval=1112173075 TSecr=277353770 SLE=5242 SRE=10350"
"904","1.357367","17.57.144.119","192.168.86.162","TCP","78","[TCP Dup ACK 803#4] 5223  >  56137 [ACK] Seq=4027 Ack=2346 Win=31872 Len=0 TSval=1112173075 TSecr=277353770 SLE=5242 SRE=11672"
"905","1.357367","37.16.4.196","192.168.86.162","TCP","1234","443  >  56148 [ACK] Seq=181 Ack=518 Win=67584 Len=1168 TSval=1091580063 TSecr=1349090134 [TCP PDU reassembled in 919]"
"911","1.357580","192.168.86.162","37.16.4.196","TCP","78","[TCP Dup ACK 784#1] 56148  >  443 [ACK] Seq=518 Ack=1 Win=131968 Len=0 TSval=1349090342 TSecr=1091580062 SLE=128 SRE=1349"
"912","1.357581","192.168.86.162","162.125.40.1","TCP","66","56138  >  443 [ACK] Seq=307 Ack=3889 Win=130752 Len=0 TSval=2625282689 TSecr=724434711"
"913","1.357581","192.168.86.162","104.154.127.247","TCP","66","56149  >  4070 [ACK] Seq=1 Ack=1 Win=132352 Len=0 TSval=2267297506 TSecr=3090622504"
"914","1.357582","192.168.86.162","192.225.158.2","TCP","66","56146  >  3478 [ACK] Seq=177 Ack=149 Win=131584 Len=0 TSval=2782124925 TSecr=2500208043"
"915","1.357583","192.168.86.162","17.57.144.119","TCP","1514","[TCP Fast Retransmission] 56137  >  5223 [ACK] Seq=2346 Ack=4027 Win=131072 Len=1448 TSval=277353932 TSecr=1112173064"
"916","1.357584","192.168.86.162","17.57.144.119","TCP","1514","[TCP Fast Retransmission] 56137  >  5223 [ACK] Seq=3794 Ack=4027 Win=131072 Len=1448 TSval=277353932 TSecr=1112173064 [TCP PDU reassembled in 825]"
"917","1.357585","192.168.86.162","17.57.144.119","TCP","1514","[TCP Fast Retransmission] 56137  >  5223 [PSH, ACK] Seq=10334 Ack=4027 Win=131072 Len=1448 TSval=277353932 TSecr=1112173064 [TCP PDU reassembled in 825], Application Data, Application Data, Application Data"
"923","1.358177","37.16.4.196","192.168.86.162","TCP","193","[TCP Out-Of-Order] 443  >  56148 [PSH, ACK] Seq=1 Ack=518 Win=67584 Len=127 TSval=1091580063 TSecr=1349090134"
"929","1.358179","17.57.144.119","192.168.86.162","TCP","78","[TCP Dup ACK 803#5] 5223  >  56137 [ACK] Seq=4027 Ack=2346 Win=31872 Len=0 TSval=1112173079 TSecr=277353770 SLE=5242 SRE=11782"
