No.     Time           Source                Destination           Protocol Length Info
      1 0.000000       fe80::1cc1:4cef:1e0a:8c4f ff02::16              ICMPv6   90     Multicast Listener Report Message v2

Frame 1: 90 bytes on wire (720 bits), 90 bytes captured (720 bits) on interface en0, id 0
Ethernet II, Src: Apple_28:ee:7d (ac:c9:06:28:ee:7d), Dst: IPv6mcast_16 (33:33:00:00:00:16)
Internet Protocol Version 6, Src: fe80::1cc1:4cef:1e0a:8c4f, Dst: ff02::16
Internet Control Message Protocol v6

No.     Time           Source                Destination           Protocol Length Info
      2 0.000012       fe80::1cc1:4cef:1e0a:8c4f ff02::16              ICMPv6   130    Multicast Listener Report Message v2

Frame 2: 130 bytes on wire (1040 bits), 130 bytes captured (1040 bits) on interface en0, id 0
Ethernet II, Src: Apple_28:ee:7d (ac:c9:06:28:ee:7d), Dst: IPv6mcast_16 (33:33:00:00:00:16)
Internet Protocol Version 6, Src: fe80::1cc1:4cef:1e0a:8c4f, Dst: ff02::16
Internet Control Message Protocol v6

No.     Time           Source                Destination           Protocol Length Info
      3 0.000020       ::                    ff02::16              ICMPv6   110    Multicast Listener Report Message v2

Frame 3: 110 bytes on wire (880 bits), 110 bytes captured (880 bits) on interface en0, id 0
Ethernet II, Src: Apple_28:ee:7d (ac:c9:06:28:ee:7d), Dst: IPv6mcast_16 (33:33:00:00:00:16)
Internet Protocol Version 6, Src: ::, Dst: ff02::16
Internet Control Message Protocol v6

No.     Time           Source                Destination           Protocol Length Info
      4 0.000438       192.168.86.162        17.57.144.121         TLSv1.2  104    Application Data

Frame 4: 104 bytes on wire (832 bits), 104 bytes captured (832 bits) on interface en0, id 0
Ethernet II, Src: Apple_28:ee:7d (ac:c9:06:28:ee:7d), Dst: Google_d2:e0:5b (28:bd:89:d2:e0:5b)
Internet Protocol Version 4, Src: 192.168.86.162, Dst: 17.57.144.121
Transmission Control Protocol, Src Port: 49593, Dst Port: 5223, Seq: 1, Ack: 1, Len: 38
Transport Layer Security

No.     Time           Source                Destination           Protocol Length Info
      5 0.000441       192.168.86.162        192.168.86.1          DNS      69     Standard query 0x6eb2 A apple.com

Frame 5: 69 bytes on wire (552 bits), 69 bytes captured (552 bits) on interface en0, id 0
Ethernet II, Src: Apple_28:ee:7d (ac:c9:06:28:ee:7d), Dst: Google_d2:e0:5b (28:bd:89:d2:e0:5b)
Internet Protocol Version 4, Src: 192.168.86.162, Dst: 192.168.86.1
User Datagram Protocol, Src Port: 49597, Dst Port: 53
Domain Name System (query)

No.     Time           Source                Destination           Protocol Length Info
      6 0.000448       192.168.86.162        192.168.86.1          DNS      73     Standard query 0xfd9f A www.apple.com

Frame 6: 73 bytes on wire (584 bits), 73 bytes captured (584 bits) on interface en0, id 0
Ethernet II, Src: Apple_28:ee:7d (ac:c9:06:28:ee:7d), Dst: Google_d2:e0:5b (28:bd:89:d2:e0:5b)
Internet Protocol Version 4, Src: 192.168.86.162, Dst: 192.168.86.1
User Datagram Protocol, Src Port: 59189, Dst Port: 53
Domain Name System (query)

No.     Time           Source                Destination           Protocol Length Info
      7 0.000453       192.168.86.162        192.168.86.1          DNS      79     Standard query 0x02bb HTTPS clients1.google.com

Frame 7: 79 bytes on wire (632 bits), 79 bytes captured (632 bits) on interface en0, id 0
Ethernet II, Src: Apple_28:ee:7d (ac:c9:06:28:ee:7d), Dst: Google_d2:e0:5b (28:bd:89:d2:e0:5b)
Internet Protocol Version 4, Src: 192.168.86.162, Dst: 192.168.86.1
User Datagram Protocol, Src Port: 59151, Dst Port: 53
Domain Name System (query)

No.     Time           Source                Destination           Protocol Length Info
      8 0.000459       192.168.86.162        192.168.86.1          DNS      79     Standard query 0xef60 A clients1.google.com

Frame 8: 79 bytes on wire (632 bits), 79 bytes captured (632 bits) on interface en0, id 0
Ethernet II, Src: Apple_28:ee:7d (ac:c9:06:28:ee:7d), Dst: Google_d2:e0:5b (28:bd:89:d2:e0:5b)
Internet Protocol Version 4, Src: 192.168.86.162, Dst: 192.168.86.1
User Datagram Protocol, Src Port: 63638, Dst Port: 53
Domain Name System (query)

No.     Time           Source                Destination           Protocol Length Info
      9 0.000463       192.168.86.162        192.168.86.1          DNS      78     Standard query 0x80bb A client.dropbox.com

Frame 9: 78 bytes on wire (624 bits), 78 bytes captured (624 bits) on interface en0, id 0
Ethernet II, Src: Apple_28:ee:7d (ac:c9:06:28:ee:7d), Dst: Google_d2:e0:5b (28:bd:89:d2:e0:5b)
Internet Protocol Version 4, Src: 192.168.86.162, Dst: 192.168.86.1
User Datagram Protocol, Src Port: 52845, Dst Port: 53
Domain Name System (query)

No.     Time           Source                Destination           Protocol Length Info
     10 0.000466       192.168.86.162        192.168.86.1          DNS      82     Standard query 0xaa08 A api.apple-cloudkit.com

Frame 10: 82 bytes on wire (656 bits), 82 bytes captured (656 bits) on interface en0, id 0
Ethernet II, Src: Apple_28:ee:7d (ac:c9:06:28:ee:7d), Dst: Google_d2:e0:5b (28:bd:89:d2:e0:5b)
Internet Protocol Version 4, Src: 192.168.86.162, Dst: 192.168.86.1
User Datagram Protocol, Src Port: 54784, Dst Port: 53
Domain Name System (query)

No.     Time           Source                Destination           Protocol Length Info
     11 0.000469       192.168.86.162        192.168.86.1          DNS      84     Standard query 0xe71f A 1-courier.push.apple.com

Frame 11: 84 bytes on wire (672 bits), 84 bytes captured (672 bits) on interface en0, id 0
Ethernet II, Src: Apple_28:ee:7d (ac:c9:06:28:ee:7d), Dst: Google_d2:e0:5b (28:bd:89:d2:e0:5b)
Internet Protocol Version 4, Src: 192.168.86.162, Dst: 192.168.86.1
User Datagram Protocol, Src Port: 56542, Dst Port: 53
Domain Name System (query)

No.     Time           Source                Destination           Protocol Length Info
     12 0.000472       192.168.86.162        192.168.86.1          DNS      92     Standard query 0x1831 A 1-courier.sandbox.push.apple.com

Frame 12: 92 bytes on wire (736 bits), 92 bytes captured (736 bits) on interface en0, id 0
Ethernet II, Src: Apple_28:ee:7d (ac:c9:06:28:ee:7d), Dst: Google_d2:e0:5b (28:bd:89:d2:e0:5b)
Internet Protocol Version 4, Src: 192.168.86.162, Dst: 192.168.86.1
User Datagram Protocol, Src Port: 50691, Dst Port: 53
Domain Name System (query)

No.     Time           Source                Destination           Protocol Length Info
     13 0.000475       192.168.86.162        192.168.86.1          DNS      75     Standard query 0x4f32 A www.spotify.com

Frame 13: 75 bytes on wire (600 bits), 75 bytes captured (600 bits) on interface en0, id 0
Ethernet II, Src: Apple_28:ee:7d (ac:c9:06:28:ee:7d), Dst: Google_d2:e0:5b (28:bd:89:d2:e0:5b)
Internet Protocol Version 4, Src: 192.168.86.162, Dst: 192.168.86.1
User Datagram Protocol, Src Port: 57138, Dst Port: 53
Domain Name System (query)

No.     Time           Source                Destination           Protocol Length Info
     14 0.000477       192.168.86.162        192.168.86.1          DNS      77     Standard query 0xb152 HTTPS www3.l.google.com

Frame 14: 77 bytes on wire (616 bits), 77 bytes captured (616 bits) on interface en0, id 0
Ethernet II, Src: Apple_28:ee:7d (ac:c9:06:28:ee:7d), Dst: Google_d2:e0:5b (28:bd:89:d2:e0:5b)
Internet Protocol Version 4, Src: 192.168.86.162, Dst: 192.168.86.1
User Datagram Protocol, Src Port: 59881, Dst Port: 53
Domain Name System (query)

No.     Time           Source                Destination           Protocol Length Info
     15 0.000479       192.168.86.162        192.168.86.1          DNS      91     Standard query 0x36bb HTTPS signaler-pa.clients6.google.com

Frame 15: 91 bytes on wire (728 bits), 91 bytes captured (728 bits) on interface en0, id 0
Ethernet II, Src: Apple_28:ee:7d (ac:c9:06:28:ee:7d), Dst: Google_d2:e0:5b (28:bd:89:d2:e0:5b)
Internet Protocol Version 4, Src: 192.168.86.162, Dst: 192.168.86.1
User Datagram Protocol, Src Port: 61576, Dst Port: 53
Domain Name System (query)

No.     Time           Source                Destination           Protocol Length Info
     16 0.000482       192.168.86.162        192.168.86.1          DNS      91     Standard query 0x0c69 A signaler-pa.clients6.google.com

Frame 16: 91 bytes on wire (728 bits), 91 bytes captured (728 bits) on interface en0, id 0
Ethernet II, Src: Apple_28:ee:7d (ac:c9:06:28:ee:7d), Dst: Google_d2:e0:5b (28:bd:89:d2:e0:5b)
Internet Protocol Version 4, Src: 192.168.86.162, Dst: 192.168.86.1
User Datagram Protocol, Src Port: 57657, Dst Port: 53
Domain Name System (query)

No.     Time           Source                Destination           Protocol Length Info
     17 0.000487       192.168.86.162        192.168.86.1          DNS      89     Standard query 0x2370 A pagead2.googlesyndication.com

Frame 17: 89 bytes on wire (712 bits), 89 bytes captured (712 bits) on interface en0, id 0
Ethernet II, Src: Apple_28:ee:7d (ac:c9:06:28:ee:7d), Dst: Google_d2:e0:5b (28:bd:89:d2:e0:5b)
Internet Protocol Version 4, Src: 192.168.86.162, Dst: 192.168.86.1
User Datagram Protocol, Src Port: 51429, Dst Port: 53
Domain Name System (query)

No.     Time           Source                Destination           Protocol Length Info
     18 0.000489       192.168.86.162        192.168.86.1          DNS      84     Standard query 0xfffe HTTPS www.google-analytics.com

Frame 18: 84 bytes on wire (672 bits), 84 bytes captured (672 bits) on interface en0, id 0
Ethernet II, Src: Apple_28:ee:7d (ac:c9:06:28:ee:7d), Dst: Google_d2:e0:5b (28:bd:89:d2:e0:5b)
Internet Protocol Version 4, Src: 192.168.86.162, Dst: 192.168.86.1
User Datagram Protocol, Src Port: 58739, Dst Port: 53
Domain Name System (query)

No.     Time           Source                Destination           Protocol Length Info
     19 0.000491       192.168.86.162        192.168.86.1          DNS      84     Standard query 0x87f1 A www.google-analytics.com

Frame 19: 84 bytes on wire (672 bits), 84 bytes captured (672 bits) on interface en0, id 0
Ethernet II, Src: Apple_28:ee:7d (ac:c9:06:28:ee:7d), Dst: Google_d2:e0:5b (28:bd:89:d2:e0:5b)
Internet Protocol Version 4, Src: 192.168.86.162, Dst: 192.168.86.1
User Datagram Protocol, Src Port: 59369, Dst Port: 53
Domain Name System (query)

No.     Time           Source                Destination           Protocol Length Info
     20 0.000493       192.168.86.162        192.168.86.1          DNS      78     Standard query 0x4503 HTTPS cp4.cloudflare.com

Frame 20: 78 bytes on wire (624 bits), 78 bytes captured (624 bits) on interface en0, id 0
Ethernet II, Src: Apple_28:ee:7d (ac:c9:06:28:ee:7d), Dst: Google_d2:e0:5b (28:bd:89:d2:e0:5b)
Internet Protocol Version 4, Src: 192.168.86.162, Dst: 192.168.86.1
User Datagram Protocol, Src Port: 49727, Dst Port: 53
Domain Name System (query)

No.     Time           Source                Destination           Protocol Length Info
     21 0.000499       192.168.86.162        192.168.86.1          DNS      78     Standard query 0x4694 A cp4.cloudflare.com

Frame 21: 78 bytes on wire (624 bits), 78 bytes captured (624 bits) on interface en0, id 0
Ethernet II, Src: Apple_28:ee:7d (ac:c9:06:28:ee:7d), Dst: Google_d2:e0:5b (28:bd:89:d2:e0:5b)
Internet Protocol Version 4, Src: 192.168.86.162, Dst: 192.168.86.1
User Datagram Protocol, Src Port: 62914, Dst Port: 53
Domain Name System (query)

No.     Time           Source                Destination           Protocol Length Info
     22 0.000502       192.168.86.162        192.168.86.1          DNS      75     Standard query 0x8ac1 HTTPS play.google.com

Frame 22: 75 bytes on wire (600 bits), 75 bytes captured (600 bits) on interface en0, id 0
Ethernet II, Src: Apple_28:ee:7d (ac:c9:06:28:ee:7d), Dst: Google_d2:e0:5b (28:bd:89:d2:e0:5b)
Internet Protocol Version 4, Src: 192.168.86.162, Dst: 192.168.86.1
User Datagram Protocol, Src Port: 60923, Dst Port: 53
Domain Name System (query)

No.     Time           Source                Destination           Protocol Length Info
     23 0.000505       192.168.86.162        192.168.86.1          DNS      75     Standard query 0x09c4 A play.google.com

Frame 23: 75 bytes on wire (600 bits), 75 bytes captured (600 bits) on interface en0, id 0
Ethernet II, Src: Apple_28:ee:7d (ac:c9:06:28:ee:7d), Dst: Google_d2:e0:5b (28:bd:89:d2:e0:5b)
Internet Protocol Version 4, Src: 192.168.86.162, Dst: 192.168.86.1
User Datagram Protocol, Src Port: 60300, Dst Port: 53
Domain Name System (query)

No.     Time           Source                Destination           Protocol Length Info
     24 0.000507       192.168.86.162        192.168.86.1          DNS      75     Standard query 0xdd17 HTTPS ssl.gstatic.com

Frame 24: 75 bytes on wire (600 bits), 75 bytes captured (600 bits) on interface en0, id 0
Ethernet II, Src: Apple_28:ee:7d (ac:c9:06:28:ee:7d), Dst: Google_d2:e0:5b (28:bd:89:d2:e0:5b)
Internet Protocol Version 4, Src: 192.168.86.162, Dst: 192.168.86.1
User Datagram Protocol, Src Port: 51160, Dst Port: 53
Domain Name System (query)

No.     Time           Source                Destination           Protocol Length Info
     25 0.000510       192.168.86.162        192.168.86.1          DNS      75     Standard query 0xbdad A ssl.gstatic.com

Frame 25: 75 bytes on wire (600 bits), 75 bytes captured (600 bits) on interface en0, id 0
Ethernet II, Src: Apple_28:ee:7d (ac:c9:06:28:ee:7d), Dst: Google_d2:e0:5b (28:bd:89:d2:e0:5b)
Internet Protocol Version 4, Src: 192.168.86.162, Dst: 192.168.86.1
User Datagram Protocol, Src Port: 63801, Dst Port: 53
Domain Name System (query)

No.     Time           Source                Destination           Protocol Length Info
     26 0.000514       192.168.86.162        17.248.188.115        UDP      282    65308 → 443 Len=240

Frame 26: 282 bytes on wire (2256 bits), 282 bytes captured (2256 bits) on interface en0, id 0
Ethernet II, Src: Apple_28:ee:7d (ac:c9:06:28:ee:7d), Dst: Google_d2:e0:5b (28:bd:89:d2:e0:5b)
Internet Protocol Version 4, Src: 192.168.86.162, Dst: 17.248.188.115
User Datagram Protocol, Src Port: 65308, Dst Port: 443
Data (240 bytes)

0000  6a 33 14 e5 e5 0c 75 8c e0 a6 7a 0f cf 26 a6 a6   j3....u...z..&..
0010  67 f8 ee 4b 29 9e 00 c9 c0 32 ff f2 0c cb 27 8b   g..K)....2....'.
0020  f7 b5 9f 8d 12 47 7f a7 47 72 cc 0e 84 7d 96 0e   .....G..Gr...}..
0030  f0 c5 2e 10 2c 0a 9a 80 79 16 7a 10 88 fb 3c 75   ....,...y.z...<u
0040  69 f8 35 ef 04 e2 bd 75 a9 a3 9b 3a 29 ea bc bd   i.5....u...:)...
0050  4e 7b 57 de 9c 33 71 c4 81 dd 4f 4e fd a0 7b 83   N{W..3q...ON..{.
0060  40 fa 20 53 00 35 03 92 a1 3c 56 e7 9b 02 77 72   @. S.5...<V...wr
0070  e9 2f 0c 06 93 55 bb a9 e1 ba ca ec 72 f5 3e 22   ./...U......r.>"
0080  0f e4 a3 4f fc 9f 95 ab ec 45 79 cc ef d2 e0 50   ...O.....Ey....P
0090  11 7e 8e 45 b6 29 ec 73 80 a8 a0 78 f4 bb e0 84   .~.E.).s...x....
00a0  28 07 b2 a1 fc 14 5f 25 00 37 e9 a8 90 53 33 78   (....._%.7...S3x
00b0  55 f9 d6 57 f9 17 a3 86 32 7d a3 8f b5 f4 97 fd   U..W....2}......
00c0  91 96 b1 22 29 8e 81 42 f5 92 02 44 13 8b 71 fb   ...")..B...D..q.
00d0  a3 b1 6d b2 0c 33 14 fb fa 3b 30 1f 08 33 ed ec   ..m..3...;0..3..
00e0  27 71 21 98 aa fc ad 5f 8d 6e 7a ac ab 5f cc 4a   'q!...._.nz.._.J

No.     Time           Source                Destination           Protocol Length Info
     27 0.000517       192.168.86.162        17.248.188.115        UDP      282    65308 → 443 Len=240

Frame 27: 282 bytes on wire (2256 bits), 282 bytes captured (2256 bits) on interface en0, id 0
Ethernet II, Src: Apple_28:ee:7d (ac:c9:06:28:ee:7d), Dst: Google_d2:e0:5b (28:bd:89:d2:e0:5b)
Internet Protocol Version 4, Src: 192.168.86.162, Dst: 17.248.188.115
User Datagram Protocol, Src Port: 65308, Dst Port: 443
Data (240 bytes)

0000  79 33 14 e5 e5 0c 75 8c e0 a6 7a 0f cf 26 a6 a6   y3....u...z..&..
0010  67 f8 ee 4b 29 63 72 b3 b6 df d2 8f d0 7a b9 b9   g..K)cr......z..
0020  d0 21 95 22 56 28 81 4f 90 75 6c cb 1c 5f f6 e3   .!."V(.O.ul.._..
0030  6b 4a 2e 4a 0e de 4b 7c 81 b8 1c 25 29 39 6f cb   kJ.J..K|...%)9o.
0040  87 4a 8a 53 e0 b5 56 b0 7e 49 a7 f8 9c 7c 31 20   .J.S..V.~I...|1 
0050  f7 7b a4 05 81 9d 97 67 25 dc 4e 5a ba f5 21 cf   .{.....g%.NZ..!.
0060  52 08 99 5b 2c 40 1a 17 ff cd 64 8a 7e 10 1a 62   R..[,@....d.~..b
0070  39 2c c9 3f c7 f5 ac 63 83 e4 2f c9 bd 96 45 3b   9,.?...c../...E;
0080  65 b6 97 8a 94 5c 19 af d9 d0 12 19 79 e9 ec 41   e....\......y..A
0090  18 7c c5 8f b7 c2 63 5d e8 fb f5 3c 0d 75 e3 10   .|....c]...<.u..
00a0  ad 4a 66 2f 29 8e 18 18 84 76 9c f1 b0 c0 ec b4   .Jf/)....v......
00b0  4d cb 20 94 ae 9c a9 8f fa d4 c2 bb ca 15 d4 9e   M. .............
00c0  99 87 bf 6d 6b e6 ff 3f ac cc c8 dc 91 be 2c ca   ...mk..?......,.
00d0  da c5 8c ed e4 77 a5 c2 05 c1 df 00 2c 7f c5 f6   .....w......,...
00e0  26 8b a4 7e 85 40 16 5e c3 1c 73 b0 47 53 0f 00   &..~.@.^..s.GS..

No.     Time           Source                Destination           Protocol Length Info
     28 0.000524       192.168.86.162        17.248.188.115        UDP      282    65308 → 443 Len=240

Frame 28: 282 bytes on wire (2256 bits), 282 bytes captured (2256 bits) on interface en0, id 0
Ethernet II, Src: Apple_28:ee:7d (ac:c9:06:28:ee:7d), Dst: Google_d2:e0:5b (28:bd:89:d2:e0:5b)
Internet Protocol Version 4, Src: 192.168.86.162, Dst: 17.248.188.115
User Datagram Protocol, Src Port: 65308, Dst Port: 443
Data (240 bytes)

0000  78 33 14 e5 e5 0c 75 8c e0 a6 7a 0f cf 26 a6 a6   x3....u...z..&..
0010  67 f8 ee 4b 29 f5 0c 7b 23 a4 72 f7 df c0 d8 53   g..K)..{#.r....S
0020  ec 2d 16 b3 ce 8a 0f 91 20 7c 60 c1 2c 30 80 5c   .-...... |`.,0.\
0030  ca 04 d5 df 47 31 58 7a 73 45 97 dd dd 25 62 79   ....G1XzsE...%by
0040  13 9a 83 fc 25 bc e4 ea ab 1f f9 a6 ea 78 f5 f8   ....%........x..
0050  d5 ac b6 91 8f 09 82 4a 66 4e 71 ec 5b 73 24 b0   .......JfNq.[s$.
0060  cb d3 b2 07 70 5e f3 78 62 84 9b 2b 9a ce b8 57   ....p^.xb..+...W
0070  bd c3 7d e5 87 66 03 10 0a 3f e5 2c 1c e3 7b 79   ..}..f...?.,..{y
0080  4c 82 07 30 8c 0a 8d 30 b0 8d 5e 9e 36 b9 4f cf   L..0...0..^.6.O.
0090  5f df 1b 6a 02 ad 5d cf 1e 59 ac 0a 60 c4 dd 06   _..j..]..Y..`...
00a0  f4 fa d0 5f 5c f7 c0 3a 78 49 86 df 0d 11 dc 47   ..._\..:xI.....G
00b0  76 ff b3 59 e4 6d e3 61 de d0 07 e7 9c 76 a0 8c   v..Y.m.a.....v..
00c0  56 0c 40 fb cb d9 a1 61 4f a4 43 91 5a e0 85 e0   V.@....aO.C.Z...
00d0  f0 40 5e ab 56 d5 a3 63 4f 21 0d 13 5b 0b f6 fd   .@^.V..cO!..[...
00e0  15 fd c3 25 39 4e a4 10 1e 85 8e df 4b 58 61 c3   ...%9N......KXa.

No.     Time           Source                Destination           Protocol Length Info
     29 0.000527       192.168.86.162        192.168.86.1          DNS      77     Standard query 0x1cf9 A www.microsoft.com

Frame 29: 77 bytes on wire (616 bits), 77 bytes captured (616 bits) on interface en0, id 0
Ethernet II, Src: Apple_28:ee:7d (ac:c9:06:28:ee:7d), Dst: Google_d2:e0:5b (28:bd:89:d2:e0:5b)
Internet Protocol Version 4, Src: 192.168.86.162, Dst: 192.168.86.1
User Datagram Protocol, Src Port: 54501, Dst Port: 53
Domain Name System (query)

No.     Time           Source                Destination           Protocol Length Info
     30 0.000529       192.168.86.162        192.168.86.1          DNS      85     Standard query 0x8595 A e673.dsce9.akamaiedge.net

Frame 30: 85 bytes on wire (680 bits), 85 bytes captured (680 bits) on interface en0, id 0
Ethernet II, Src: Apple_28:ee:7d (ac:c9:06:28:ee:7d), Dst: Google_d2:e0:5b (28:bd:89:d2:e0:5b)
Internet Protocol Version 4, Src: 192.168.86.162, Dst: 192.168.86.1
User Datagram Protocol, Src Port: 55082, Dst Port: 53
Domain Name System (query)

No.     Time           Source                Destination           Protocol Length Info
     31 0.093443       fe80::1cc1:4cef:1e0a:8c4f ff02::16              ICMPv6   90     Multicast Listener Report Message v2

Frame 31: 90 bytes on wire (720 bits), 90 bytes captured (720 bits) on interface en0, id 0
Ethernet II, Src: Apple_28:ee:7d (ac:c9:06:28:ee:7d), Dst: IPv6mcast_16 (33:33:00:00:00:16)
Internet Protocol Version 6, Src: fe80::1cc1:4cef:1e0a:8c4f, Dst: ff02::16
Internet Control Message Protocol v6

No.     Time           Source                Destination           Protocol Length Info
     32 0.093480       fe80::1cc1:4cef:1e0a:8c4f ff02::16              ICMPv6   90     Multicast Listener Report Message v2

Frame 32: 90 bytes on wire (720 bits), 90 bytes captured (720 bits) on interface en0, id 0
Ethernet II, Src: Apple_28:ee:7d (ac:c9:06:28:ee:7d), Dst: IPv6mcast_16 (33:33:00:00:00:16)
Internet Protocol Version 6, Src: fe80::1cc1:4cef:1e0a:8c4f, Dst: ff02::16
Internet Control Message Protocol v6

No.     Time           Source                Destination           Protocol Length Info
     33 0.093482       ::                    ff02::1:ff0a:8c4f     ICMPv6   86     Neighbor Solicitation for fe80::1cc1:4cef:1e0a:8c4f

Frame 33: 86 bytes on wire (688 bits), 86 bytes captured (688 bits) on interface en0, id 0
Ethernet II, Src: Apple_28:ee:7d (ac:c9:06:28:ee:7d), Dst: IPv6mcast_ff:0a:8c:4f (33:33:ff:0a:8c:4f)
Internet Protocol Version 6, Src: ::, Dst: ff02::1:ff0a:8c4f
Internet Control Message Protocol v6

No.     Time           Source                Destination           Protocol Length Info
     34 0.095358       Apple_28:ee:7d        Google_d2:e0:5b       ARP      42     Who has 192.168.86.1? Tell 192.168.86.162

Frame 34: 42 bytes on wire (336 bits), 42 bytes captured (336 bits) on interface en0, id 0
Ethernet II, Src: Apple_28:ee:7d (ac:c9:06:28:ee:7d), Dst: Google_d2:e0:5b (28:bd:89:d2:e0:5b)
Address Resolution Protocol (request)

No.     Time           Source                Destination           Protocol Length Info
     35 0.096436       0.0.0.0               255.255.255.255       DHCP     342    DHCP Request  - Transaction ID 0x73e02fe2

Frame 35: 342 bytes on wire (2736 bits), 342 bytes captured (2736 bits) on interface en0, id 0
Ethernet II, Src: Apple_28:ee:7d (ac:c9:06:28:ee:7d), Dst: Broadcast (ff:ff:ff:ff:ff:ff)
Internet Protocol Version 4, Src: 0.0.0.0, Dst: 255.255.255.255
User Datagram Protocol, Src Port: 68, Dst Port: 67
Dynamic Host Configuration Protocol (Request)

No.     Time           Source                Destination           Protocol Length Info
     36 0.100479       fe80::1cc1:4cef:1e0a:8c4f ff02::2               ICMPv6   62     Router Solicitation

Frame 36: 62 bytes on wire (496 bits), 62 bytes captured (496 bits) on interface en0, id 0
Ethernet II, Src: Apple_28:ee:7d (ac:c9:06:28:ee:7d), Dst: IPv6mcast_02 (33:33:00:00:00:02)
Internet Protocol Version 6, Src: fe80::1cc1:4cef:1e0a:8c4f, Dst: ff02::2
Internet Control Message Protocol v6

No.     Time           Source                Destination           Protocol Length Info
     37 0.121335       fe80::1cc1:4cef:1e0a:8c4f ff02::16              ICMPv6   90     Multicast Listener Report Message v2

Frame 37: 90 bytes on wire (720 bits), 90 bytes captured (720 bits) on interface en0, id 0
Ethernet II, Src: Apple_28:ee:7d (ac:c9:06:28:ee:7d), Dst: IPv6mcast_16 (33:33:00:00:00:16)
Internet Protocol Version 6, Src: fe80::1cc1:4cef:1e0a:8c4f, Dst: ff02::16
Internet Control Message Protocol v6

No.     Time           Source                Destination           Protocol Length Info
     38 0.123104       fe80::1cc1:4cef:1e0a:8c4f ff02::fb              MDNS     442    Standard query response 0x0000 A, cache flush 192.168.86.162 A, cache flush 192.168.86.162 A, cache flush 0.0.0.0 PTR, cache flush KitKats-MacBook-Air.local NSEC, cache flush 8751c3ec-9eb6-4a28-be31-bbedc549806e.local NSEC, cache flush a8bf2832-cf4c-4eb6-aacb-ca781fb1932f.local NSEC, cache flush 90d567f1-739e-4784-9a95-3090ae3b9198.local NSEC, cache flush F.4.C.8.A.0.E.1.F.E.C.4.1.C.C.1.0.0.0.0.0.0.0.0.0.0.0.0.0.8.E.F.ip6.arpa OPT

Frame 38: 442 bytes on wire (3536 bits), 442 bytes captured (3536 bits) on interface en0, id 0
Ethernet II, Src: Apple_28:ee:7d (ac:c9:06:28:ee:7d), Dst: IPv6mcast_fb (33:33:00:00:00:fb)
Internet Protocol Version 6, Src: fe80::1cc1:4cef:1e0a:8c4f, Dst: ff02::fb
User Datagram Protocol, Src Port: 5353, Dst Port: 5353
Multicast Domain Name System (response)

No.     Time           Source                Destination           Protocol Length Info
     39 0.129286       Apple_28:ee:7d        Google_d2:e0:5b       ARP      42     Who has 192.168.86.1? Tell 192.168.86.162

Frame 39: 42 bytes on wire (336 bits), 42 bytes captured (336 bits) on interface en0, id 0
Ethernet II, Src: Apple_28:ee:7d (ac:c9:06:28:ee:7d), Dst: Google_d2:e0:5b (28:bd:89:d2:e0:5b)
Address Resolution Protocol (request)

No.     Time           Source                Destination           Protocol Length Info
     40 0.140907       192.168.86.1          192.168.86.162        DHCP     342    DHCP ACK      - Transaction ID 0x73e02fe2

Frame 40: 342 bytes on wire (2736 bits), 342 bytes captured (2736 bits) on interface en0, id 0
Ethernet II, Src: Google_d2:e0:5b (28:bd:89:d2:e0:5b), Dst: Apple_28:ee:7d (ac:c9:06:28:ee:7d)
Internet Protocol Version 4, Src: 192.168.86.1, Dst: 192.168.86.162
User Datagram Protocol, Src Port: 67, Dst Port: 68
Dynamic Host Configuration Protocol (ACK)

No.     Time           Source                Destination           Protocol Length Info
     41 0.140912       Google_d2:e0:5b       Apple_28:ee:7d        ARP      42     192.168.86.1 is at 28:bd:89:d2:e0:5b

Frame 41: 42 bytes on wire (336 bits), 42 bytes captured (336 bits) on interface en0, id 0
Ethernet II, Src: Google_d2:e0:5b (28:bd:89:d2:e0:5b), Dst: Apple_28:ee:7d (ac:c9:06:28:ee:7d)
Address Resolution Protocol (reply)

No.     Time           Source                Destination           Protocol Length Info
     42 0.140912       162.125.40.1          192.168.86.162        TLSv1.2  214    Application Data, Encrypted Alert

Frame 42: 214 bytes on wire (1712 bits), 214 bytes captured (1712 bits) on interface en0, id 0
Ethernet II, Src: Google_d2:e0:5b (28:bd:89:d2:e0:5b), Dst: Apple_28:ee:7d (ac:c9:06:28:ee:7d)
Internet Protocol Version 4, Src: 162.125.40.1, Dst: 192.168.86.162
Transmission Control Protocol, Src Port: 443, Dst Port: 56015, Seq: 1, Ack: 1, Len: 148
Transport Layer Security

No.     Time           Source                Destination           Protocol Length Info
     43 0.140913       162.125.40.1          192.168.86.162        TCP      194    [TCP Retransmission] 443 → 56015 [ACK] Seq=1 Ack=1 Win=358 Len=128 TSval=3502118457 TSecr=4174596177

Frame 43: 194 bytes on wire (1552 bits), 194 bytes captured (1552 bits) on interface en0, id 0
Ethernet II, Src: Google_d2:e0:5b (28:bd:89:d2:e0:5b), Dst: Apple_28:ee:7d (ac:c9:06:28:ee:7d)
Internet Protocol Version 4, Src: 162.125.40.1, Dst: 192.168.86.162
Transmission Control Protocol, Src Port: 443, Dst Port: 56015, Seq: 1, Ack: 1, Len: 128

No.     Time           Source                Destination           Protocol Length Info
     44 0.140913       140.82.114.25         192.168.86.162        TLSv1.2  116    Application Data, Application Data

Frame 44: 116 bytes on wire (928 bits), 116 bytes captured (928 bits) on interface en0, id 0
Ethernet II, Src: Google_d2:e0:5b (28:bd:89:d2:e0:5b), Dst: Apple_28:ee:7d (ac:c9:06:28:ee:7d)
Internet Protocol Version 4, Src: 140.82.114.25, Dst: 192.168.86.162
Transmission Control Protocol, Src Port: 443, Dst Port: 56020, Seq: 1, Ack: 1, Len: 50
Transport Layer Security

No.     Time           Source                Destination           Protocol Length Info
     45 0.141271       Apple_28:ee:7d        Broadcast             ARP      42     ARP Announcement for 192.168.86.162

Frame 45: 42 bytes on wire (336 bits), 42 bytes captured (336 bits) on interface en0, id 0
Ethernet II, Src: Apple_28:ee:7d (ac:c9:06:28:ee:7d), Dst: Broadcast (ff:ff:ff:ff:ff:ff)
Address Resolution Protocol (ARP Announcement)

No.     Time           Source                Destination           Protocol Length Info
     46 0.145487       Google_d2:e0:5b       Apple_28:ee:7d        ARP      42     192.168.86.1 is at 28:bd:89:d2:e0:5b

Frame 46: 42 bytes on wire (336 bits), 42 bytes captured (336 bits) on interface en0, id 0
Ethernet II, Src: Google_d2:e0:5b (28:bd:89:d2:e0:5b), Dst: Apple_28:ee:7d (ac:c9:06:28:ee:7d)
Address Resolution Protocol (reply)

No.     Time           Source                Destination           Protocol Length Info
     47 0.147632       Apple_28:ee:7d        Broadcast             ARP      42     Who has 192.168.86.47? Tell 192.168.86.162

Frame 47: 42 bytes on wire (336 bits), 42 bytes captured (336 bits) on interface en0, id 0
Ethernet II, Src: Apple_28:ee:7d (ac:c9:06:28:ee:7d), Dst: Broadcast (ff:ff:ff:ff:ff:ff)
Address Resolution Protocol (request)

No.     Time           Source                Destination           Protocol Length Info
     48 0.152966       192.168.86.147        192.168.86.162        DSI      70     Request Tickle (62)

Frame 48: 70 bytes on wire (560 bits), 70 bytes captured (560 bits) on interface en0, id 0
Ethernet II, Src: WesternDigit_3d:ff:45 (00:90:a9:3d:ff:45), Dst: Apple_28:ee:7d (ac:c9:06:28:ee:7d)
Internet Protocol Version 4, Src: 192.168.86.147, Dst: 192.168.86.162
Transmission Control Protocol, Src Port: 548, Dst Port: 55885, Seq: 1, Ack: 1, Len: 16
Data Stream Interface

No.     Time           Source                Destination           Protocol Length Info
     49 0.197355       WesternDigit_3d:ff:45 Broadcast             ARP      60     Who has 192.168.86.162? Tell 192.168.86.147

Frame 49: 60 bytes on wire (480 bits), 60 bytes captured (480 bits) on interface en0, id 0
Ethernet II, Src: WesternDigit_3d:ff:45 (00:90:a9:3d:ff:45), Dst: Broadcast (ff:ff:ff:ff:ff:ff)
Address Resolution Protocol (request)

No.     Time           Source                Destination           Protocol Length Info
     50 0.197436       Apple_28:ee:7d        WesternDigit_3d:ff:45 ARP      42     192.168.86.162 is at ac:c9:06:28:ee:7d

Frame 50: 42 bytes on wire (336 bits), 42 bytes captured (336 bits) on interface en0, id 0
Ethernet II, Src: Apple_28:ee:7d (ac:c9:06:28:ee:7d), Dst: WesternDigit_3d:ff:45 (00:90:a9:3d:ff:45)
Address Resolution Protocol (reply)

No.     Time           Source                Destination           Protocol Length Info
     51 0.199363       fe80::f272:eaff:fe1d:1278 ff02::1               ICMPv6   118    Router Advertisement

Frame 51: 118 bytes on wire (944 bits), 118 bytes captured (944 bits) on interface en0, id 0
Ethernet II, Src: Google_1d:12:78 (f0:72:ea:1d:12:78), Dst: IPv6mcast_01 (33:33:00:00:00:01)
Internet Protocol Version 6, Src: fe80::f272:eaff:fe1d:1278, Dst: ff02::1
Internet Control Message Protocol v6

No.     Time           Source                Destination           Protocol Length Info
     52 0.199554       ::                    ff02::1:ffba:6bd3     ICMPv6   86     Neighbor Solicitation for fd66:2118:9c14:90fe:18c1:b965:49ba:6bd3

Frame 52: 86 bytes on wire (688 bits), 86 bytes captured (688 bits) on interface en0, id 0
Ethernet II, Src: Apple_28:ee:7d (ac:c9:06:28:ee:7d), Dst: IPv6mcast_ff:ba:6b:d3 (33:33:ff:ba:6b:d3)
Internet Protocol Version 6, Src: ::, Dst: ff02::1:ffba:6bd3
Internet Control Message Protocol v6

No.     Time           Source                Destination           Protocol Length Info
     53 0.199570       fe80::1cc1:4cef:1e0a:8c4f ff02::16              ICMPv6   90     Multicast Listener Report Message v2

Frame 53: 90 bytes on wire (720 bits), 90 bytes captured (720 bits) on interface en0, id 0
Ethernet II, Src: Apple_28:ee:7d (ac:c9:06:28:ee:7d), Dst: IPv6mcast_16 (33:33:00:00:00:16)
Internet Protocol Version 6, Src: fe80::1cc1:4cef:1e0a:8c4f, Dst: ff02::16
Internet Control Message Protocol v6

No.     Time           Source                Destination           Protocol Length Info
     54 0.207194       Apple_63:d7:27        Apple_28:ee:7d        ARP      42     192.168.86.47 is at ac:bc:32:63:d7:27

Frame 54: 42 bytes on wire (336 bits), 42 bytes captured (336 bits) on interface en0, id 0
Ethernet II, Src: Apple_63:d7:27 (ac:bc:32:63:d7:27), Dst: Apple_28:ee:7d (ac:c9:06:28:ee:7d)
Address Resolution Protocol (reply)

No.     Time           Source                Destination           Protocol Length Info
     55 0.207241       192.168.86.162        192.168.86.47         TCP      78     56126 → 7000 [SYN, ECE, CWR] Seq=0 Win=65535 Len=0 MSS=1460 WS=64 TSval=3598801334 TSecr=0 SACK_PERM

Frame 55: 78 bytes on wire (624 bits), 78 bytes captured (624 bits) on interface en0, id 0
Ethernet II, Src: Apple_28:ee:7d (ac:c9:06:28:ee:7d), Dst: Apple_63:d7:27 (ac:bc:32:63:d7:27)
Internet Protocol Version 4, Src: 192.168.86.162, Dst: 192.168.86.47
Transmission Control Protocol, Src Port: 56126, Dst Port: 7000, Seq: 0, Len: 0

No.     Time           Source                Destination           Protocol Length Info
     56 0.216223       192.168.86.47         192.168.86.162        TCP      78     7000 → 56126 [SYN, ACK] Seq=0 Ack=1 Win=65535 Len=0 MSS=1460 WS=32 TSval=2796585809 TSecr=3598801334 SACK_PERM

Frame 56: 78 bytes on wire (624 bits), 78 bytes captured (624 bits) on interface en0, id 0
Ethernet II, Src: Apple_63:d7:27 (ac:bc:32:63:d7:27), Dst: Apple_28:ee:7d (ac:c9:06:28:ee:7d)
Internet Protocol Version 4, Src: 192.168.86.47, Dst: 192.168.86.162
Transmission Control Protocol, Src Port: 7000, Dst Port: 56126, Seq: 0, Ack: 1, Len: 0

No.     Time           Source                Destination           Protocol Length Info
     57 0.216324       192.168.86.162        192.168.86.47         TCP      66     56126 → 7000 [ACK] Seq=1 Ack=1 Win=131712 Len=0 TSval=3598801402 TSecr=2796585809

Frame 57: 66 bytes on wire (528 bits), 66 bytes captured (528 bits) on interface en0, id 0
Ethernet II, Src: Apple_28:ee:7d (ac:c9:06:28:ee:7d), Dst: Apple_63:d7:27 (ac:bc:32:63:d7:27)
Internet Protocol Version 4, Src: 192.168.86.162, Dst: 192.168.86.47
Transmission Control Protocol, Src Port: 56126, Dst Port: 7000, Seq: 1, Ack: 1, Len: 0

No.     Time           Source                Destination           Protocol Length Info
     58 0.216402       192.168.86.162        192.168.86.47         TCP      107    56126 → 7000 [PSH, ACK] Seq=1 Ack=1 Win=131712 Len=41 TSval=3598801402 TSecr=2796585809

Frame 58: 107 bytes on wire (856 bits), 107 bytes captured (856 bits) on interface en0, id 0
Ethernet II, Src: Apple_28:ee:7d (ac:c9:06:28:ee:7d), Dst: Apple_63:d7:27 (ac:bc:32:63:d7:27)
Internet Protocol Version 4, Src: 192.168.86.162, Dst: 192.168.86.47
Transmission Control Protocol, Src Port: 56126, Dst Port: 7000, Seq: 1, Ack: 1, Len: 41

No.     Time           Source                Destination           Protocol Length Info
     59 0.223529       192.168.86.162        224.0.0.251           MDNS     477    Standard query response 0x0000 A, cache flush 192.168.86.162 A, cache flush 192.168.86.162 A, cache flush 0.0.0.0 PTR, cache flush KitKats-MacBook-Air.local PTR, cache flush KitKats-MacBook-Air.local NSEC, cache flush 8751c3ec-9eb6-4a28-be31-bbedc549806e.local NSEC, cache flush a8bf2832-cf4c-4eb6-aacb-ca781fb1932f.local NSEC, cache flush 90d567f1-739e-4784-9a95-3090ae3b9198.local NSEC, cache flush F.4.C.8.A.0.E.1.F.E.C.4.1.C.C.1.0.0.0.0.0.0.0.0.0.0.0.0.0.8.E.F.ip6.arpa NSEC, cache flush 162.86.168.192.in-addr.arpa OPT

Frame 59: 477 bytes on wire (3816 bits), 477 bytes captured (3816 bits) on interface en0, id 0
Ethernet II, Src: Apple_28:ee:7d (ac:c9:06:28:ee:7d), Dst: IPv4mcast_fb (01:00:5e:00:00:fb)
Internet Protocol Version 4, Src: 192.168.86.162, Dst: 224.0.0.251
User Datagram Protocol, Src Port: 5353, Dst Port: 5353
Multicast Domain Name System (response)

No.     Time           Source                Destination           Protocol Length Info
     60 0.223575       fe80::1cc1:4cef:1e0a:8c4f ff02::fb              MDNS     497    Standard query response 0x0000 A, cache flush 192.168.86.162 A, cache flush 192.168.86.162 A, cache flush 0.0.0.0 PTR, cache flush KitKats-MacBook-Air.local PTR, cache flush KitKats-MacBook-Air.local NSEC, cache flush 8751c3ec-9eb6-4a28-be31-bbedc549806e.local NSEC, cache flush a8bf2832-cf4c-4eb6-aacb-ca781fb1932f.local NSEC, cache flush 90d567f1-739e-4784-9a95-3090ae3b9198.local NSEC, cache flush F.4.C.8.A.0.E.1.F.E.C.4.1.C.C.1.0.0.0.0.0.0.0.0.0.0.0.0.0.8.E.F.ip6.arpa NSEC, cache flush 162.86.168.192.in-addr.arpa OPT

Frame 60: 497 bytes on wire (3976 bits), 497 bytes captured (3976 bits) on interface en0, id 0
Ethernet II, Src: Apple_28:ee:7d (ac:c9:06:28:ee:7d), Dst: IPv6mcast_fb (33:33:00:00:00:fb)
Internet Protocol Version 6, Src: fe80::1cc1:4cef:1e0a:8c4f, Dst: ff02::fb
User Datagram Protocol, Src Port: 5353, Dst Port: 5353
Multicast Domain Name System (response)

No.     Time           Source                Destination           Protocol Length Info
     61 0.224921       192.168.86.47         192.168.86.162        TCP      66     7000 → 56126 [ACK] Seq=1 Ack=42 Win=131712 Len=0 TSval=2796585817 TSecr=3598801402

Frame 61: 66 bytes on wire (528 bits), 66 bytes captured (528 bits) on interface en0, id 0
Ethernet II, Src: Apple_63:d7:27 (ac:bc:32:63:d7:27), Dst: Apple_28:ee:7d (ac:c9:06:28:ee:7d)
Internet Protocol Version 4, Src: 192.168.86.47, Dst: 192.168.86.162
Transmission Control Protocol, Src Port: 7000, Dst Port: 56126, Seq: 1, Ack: 42, Len: 0

No.     Time           Source                Destination           Protocol Length Info
     62 0.240888       192.168.86.47         192.168.86.162        TCP      1514   7000 → 56126 [ACK] Seq=1 Ack=42 Win=131712 Len=1448 TSval=2796585833 TSecr=3598801402

Frame 62: 1514 bytes on wire (12112 bits), 1514 bytes captured (12112 bits) on interface en0, id 0
Ethernet II, Src: Apple_63:d7:27 (ac:bc:32:63:d7:27), Dst: Apple_28:ee:7d (ac:c9:06:28:ee:7d)
Internet Protocol Version 4, Src: 192.168.86.47, Dst: 192.168.86.162
Transmission Control Protocol, Src Port: 7000, Dst Port: 56126, Seq: 1, Ack: 42, Len: 1448

No.     Time           Source                Destination           Protocol Length Info
     63 0.240966       192.168.86.162        192.168.86.47         TCP      66     56126 → 7000 [ACK] Seq=42 Ack=1449 Win=130304 Len=0 TSval=3598801427 TSecr=2796585833

Frame 63: 66 bytes on wire (528 bits), 66 bytes captured (528 bits) on interface en0, id 0
Ethernet II, Src: Apple_28:ee:7d (ac:c9:06:28:ee:7d), Dst: Apple_63:d7:27 (ac:bc:32:63:d7:27)
Internet Protocol Version 4, Src: 192.168.86.162, Dst: 192.168.86.47
Transmission Control Protocol, Src Port: 56126, Dst Port: 7000, Seq: 42, Ack: 1449, Len: 0

No.     Time           Source                Destination           Protocol Length Info
     64 0.241300       192.168.86.47         192.168.86.162        TCP      677    7000 → 56126 [PSH, ACK] Seq=1449 Ack=42 Win=131712 Len=611 TSval=2796585833 TSecr=3598801402

Frame 64: 677 bytes on wire (5416 bits), 677 bytes captured (5416 bits) on interface en0, id 0
Ethernet II, Src: Apple_63:d7:27 (ac:bc:32:63:d7:27), Dst: Apple_28:ee:7d (ac:c9:06:28:ee:7d)
Internet Protocol Version 4, Src: 192.168.86.47, Dst: 192.168.86.162
Transmission Control Protocol, Src Port: 7000, Dst Port: 56126, Seq: 1449, Ack: 42, Len: 611

No.     Time           Source                Destination           Protocol Length Info
     65 0.241342       192.168.86.162        192.168.86.47         TCP      66     56126 → 7000 [ACK] Seq=42 Ack=2060 Win=130432 Len=0 TSval=3598801427 TSecr=2796585833

Frame 65: 66 bytes on wire (528 bits), 66 bytes captured (528 bits) on interface en0, id 0
Ethernet II, Src: Apple_28:ee:7d (ac:c9:06:28:ee:7d), Dst: Apple_63:d7:27 (ac:bc:32:63:d7:27)
Internet Protocol Version 4, Src: 192.168.86.162, Dst: 192.168.86.47
Transmission Control Protocol, Src Port: 56126, Dst Port: 7000, Seq: 42, Ack: 2060, Len: 0

No.     Time           Source                Destination           Protocol Length Info
     66 0.241487       192.168.86.162        192.168.86.47         TCP      66     56126 → 7000 [FIN, ACK] Seq=42 Ack=2060 Win=131072 Len=0 TSval=3598801427 TSecr=2796585833

